id	message	like_count
269850230303381_1820659261304521	262	Esse povo não pensa! Tdos esses anos no governo e o Brasil esta desse jeito se fossem tao bom assim, nao estaria tão ruim esse país! Com tanta corrupção no governo! Acorda Povo queremos Mudança. Vamos da oportunidade para outra pessoa diferente mostra que o Brasil tem jeito sim, menos corrupção e mais investimento em melhoria pro nosso país! 
#Bolsonaro17 🤗
269850230303381_269852103636527	227	Nos vamos te eleger! 
Vamos dar orgulho ao nosso querido Lula!
Haddad 13
Manu 13
269850230303381_269854803636257	232	O Brasil acordou..Lula nunca mais.pt acabou com o nosso Brasil.
269850230303381_269905336964537	90	Vc Lula e uma história mais linda que vamos te ogulho de contar ⭐⭐👍❤️ Haddad . Lula livre
269850230303381_269989123622825	105	'O Brasil mostrado nas propagandas eleitorais está longe de ser o q vivemos na realidade. Enquanto marketeiros formulam palavras bonitas e narram um conto de fadas'...

Por isso estamos c @jairbolsonaro por acreditar q nosso futuro vai mto além de falácias e sim de atitudes!!
269850230303381_269893496965721	63	Lula querido,  saudades do seu governo. O povo agora come capim e diz amém. Nosso Brasil precisa muito de educação e cultura para se desenvolver, abrir esses mentes duras. Se Deus quiser logo estará livre e lutando por seu povo como sempre fez. ♥♥♥
269850230303381_269952890293115	58	Nois o povo da bahia te amamos lula somos grato por td q vç fez por nois nuca iremos esqueçe. Vç foi e sera o nosso eterno presidente melhor do nosso Brasil #13 neles vamos la hadd
269850230303381_269947863626951	59	Já foi o tempo dessa mesma conversa gente!!!Ja está passando da hora de falar de outros tempos no Brasil. Lula já foi e não restou nem pó. É preciso e urgente mudar o rumo da prosa brasileiros. Temos novos horizontes para avistar.......
269850230303381_269953423626395	51	Vamos de Haddad em homenagem ao Lula 13 o melhor presidente do Brasil
269850230303381_269865750301829	53	Nos vamos te eleger!!!! 
Por você agora você é lula e vai ser nosso orgulho Haddad agora é 13
269850230303381_269989600289444	48	Lula foi o melhor presidente do Brasil e o Haddad o melhor ministro da educação. Precisamos eleger Haddad.
269850230303381_269853596969711	119	Vote HADDAD/LULA/MANU🌹 13 . O Brasil feliz de novo . #somostodoslula
269850230303381_269862490302155	47	Hadad 13. O melhor ministro da educação qie o Brasil já teve, por isso voto 13.
269850230303381_634237343644627	47	Nota-se claramente o legado após 13 anos do PT a frente da Educação no Brasil, estamos no fundo do poço, nossos jovens mal sabem soletrar as palavras, Pátria Educadora !!!! PT nunca mais
269850230303381_269855390302865	46	Haddad, não vamos deixar o golpe se esticar ainda mais! Vamos elegê- lo o nosso presidente pra vc trazer o Brasil do Lula de volta! Confio em vc guerreiro!
269850230303381_269858506969220	52	Kkkkkk vai lá... Estranho, todo pobre que o 9 dedos tirou da pobreza, continua tudo pobre . 🤣🤣🤣🤣
269850230303381_269871703634567	43	Temos que vencer a violência e a desigualdade que outros candidatos estão pregando..E pra isso temos que ser todos por Haddad/Lula 13
A vitória será nossa🙏❤
#Haddad13
#Manu
269850230303381_269952900293114	37	Vamos a mais uma vitória do povo. Que o Senhor Deus te cubra, ó Fernando Haddad de sabedoria, de paz no coração, de fé no Deus vivo para voltarmos a ter um Brasil respeitado e o povo com pobre com sua dignidade de volta. Que o Senhor te abençoe, te guarde e te conceda esta conquista.
269850230303381_956580187859153	35	Me desculpem aparecer aqui na postagem de vocês mas, meu candidato está de atestado e eu fiquei responsável por fazer a campanha dele .
Vote #bolsonaro17
Obrigado pela atenção!
269850230303381_269866000301804	31	É 13! Educação é prioridade! Todo Brasileiro deve ter acesso e de qualidade.
269850230303381_269855286969542	36	Com certeza eis um orgulho  pra mim e toda minha família  votar no Lula 13 sempre ao seu lado
269850230303381_270006603621077	34	Orgulho de ser indicado por um preso? Kkk os valores estão mesmo inversos...

#17Bolsonaro
269850230303381_269880083633729	31	Tenho muita admiração por você, Fernando Haddad! Acredito que você é uma pessoa sensata, inteligente e capacitada para ser nosso presidente. Torço por você!
269850230303381_269857250302679	26	Pela continuidade do PROUNI que transformará os sonhos de milhares de estudantes  (como minha filha) em realidade eu voto Haddad
269850230303381_269980163623721	24	É Haddad/Manuela por honra ao nosso eterno presidente Lula e em resposta ao golpe covardemente desferido na democracia brasileira 🇧🇷
269850230303381_269948043626933	22	Deus  te  proteja  meu  querido  lula  o melhor  presidente  do  Brasil  lula  livre  hadadd  presidente
269850230303381_269977883623949	23	Melhor presidente que o Brasil já teve...
Lula vc é um divisor de águas:  NORDESTE ANTES DE LULA E DEPOIS DE LULA!!!
Nordestino que tem sentimento de gratidão eternamente vota 13 !!
Avante HADAD !!!
269850230303381_269887943632943	23	Nosso eterno presidente serás com muito orgulho bem representado! PT 13 Haddad
269850230303381_269989626956108	23	16 anos perdidos alunos passavam sem nenhum conhecimento das matérias mal sabem fazer uma conta de dividir! Vc é péssimo em tudo que faz ja dizia o datena .....
269850230303381_2025224357515871	16	Deus ti cubra de bênção você lula paí dos pobres eu esto com você lula o melhor presidente do Brasil lula livre
269850230303381_269862450302159	19	UM CONVITE PARA RACIOCINAR JUNTOS
Você que apoia Lula e pretende anular o voto, faço aqui um convite: vamos raciocinar juntos. Todos os votos nulos são contabilizados quantitativamente, sem distinções entre eles. Não existe uma diferenciação qualitativa dos votos nulos. Quando somados, os votos nulos não expressam uma posição política definida, mas algum tipo de descontentamento difuso. Assim, se você apoia Lula e crê que o seu voto nulo será entendido como um protesto contra o golpe ou contra uma eleição que você considera fraudulenta, isso não vai acontecer. O seu voto nulo estará misturado com os votos daqueles que são apolíticos, daqueles que são contra toda a classe política, dos anarquistas utópicos de direita, daqueles extremistas que advogam pelo Estado mínimo etc. Portanto, seu voto nulo será indistinguível de tantas outras causas contrárias aos ideais políticos de Lula. Por outro lado, se você  votar em Haddad e Manuela, além de estar de fato honrando um pedido feito publicamente pelo próprio Lula, você estará deixando registrado, quantitativa e qualitativamente, o seu voto de protesto contra o golpe, contra o impedimento da candidatura de Lula e a favor da vontade de Lula. Cada voto em Haddad e Manuela será uma mensagem clara e direta em apoio ao ex-presidente Lula e uma oportunidade real de ganhar uma eleição que havia sido montada (com STF e com tudo) para enterrar de vez o capital político de Lula e do PT. Reflita bem.
269850230303381_269854293636308	15	Pra cima deles! Revitalizar o ensino e criar novas oportunidades de aprendizado para essa juventude não pensar em drogas.
269850230303381_2177304925621303	13	LULA   foi o melhor  presente   que o  brasil  teve  vamos  de  Haddad  presidente
269850230303381_271461847028076	14	Lula, fique tranquilo, porque vamos solta-lo, assim que Haddad assumir à presidência da república.
269850230303381_2203893839899845	16	Isso mesmo, no dia 7 de outubro vamos as urnas e olhar com firmeza nas teclas para não errar quando  for digitar 1 e 7 antes da tecla "Confirma"
Entendidos?
269850230303381_269944810293923	14	Os menos favorecidos do Brasil fica triste por saber que somente cinco juiz mando no país e impede que quer ajudar os menos favorecidos a classe mais umilde do Brasil lamentável
269850230303381_269965660291838	12	Meu presidente querido por todos lula vamos vota para tirá lula do cativeiro dos perversos
269850230303381_2203847763237786	12	Parabéns Lula!  Agora é HADDAD e aprendeu com vc fazer o Brasil sorrir de novo.
269850230303381_269945110293893	14	Kkkkkk tá preso e outro só dou 4 meses pra achar um cantinho na cadeia
269850230303381_2177184935633302	12	É verdade meu presidente  você e Lula do Brasil que Deus te abençoe e dailhe 13 neles
269850230303381_269856966969374	22	Somente Haddad apoiado por Lula pode ganhar as eleições já no primeiro turno! Quer paz? Vote 13 para não ter segundo turno e não dar chance para armações do coiso!
269850230303381_2163941490526438	12	O Brasil voltará ter empregos. Salário pra esse povo. Os aposentados um aumento de acordo com inflação. Minha casa minha vida. Investimento em pessoal precisa de faculdade. Então o Brasil vai sorrir de novo Hadad 13
269850230303381_271935766754174	11	Essa roupa que o lula está vestindo é do partido ou é uniforme da cadeia?
269850230303381_725461797801491	8	Kkkkkkkkkkkk se fizeram tudo isso, porque então Brasil tem tantos analfabeto?
269850230303381_1648829835218561	8	Vai mosonaro sai deste ospital e mostre para a nação brasileira nos  estamos com Tigo Deus te proteja
269850230303381_269940233627714	12	Tem uma coisa errada aí. A Educação vai mal a pior. Não da para entender.
269850230303381_269888690299535	13	Aguenta firme amigo, estamos orando por você, e sabemos q vc vai sair dessa ainda mais fortalecido, se crusificarao até Jesus, como não iriao armar pra cima de vc, tenha fé.
269850230303381_269861386968932	13	Haddad 13 na cabeça. Rio de Janeiro - quem vota Haddad vota também em Lindbergh
269850230303381_248800039170603	10	Lula O presidente mais inteligente q o Brasil já teve sua luta não pode parar, é 13 vamos com Haddad
269850230303381_475115179668612	10	O Lula foi o melhor Presidente qué esse Brasil já teve e agora eu so Heddad e 13 🙏
269850230303381_269964576958613	12	Eu tambem carrego com muito orgulho o governo do Lula.... o melhor presidente que o Brasil já teve.
269850230303381_341344443276294	9	Eu voto nu Lula quantas vezes for eu nunca vi presidente igual o lula antes dele néngem fez nada ou quem ele apoia
269850230303381_298836177610734	9	Vai ser lula de novo que Deus ilumine a vida dele que vem fazer coisas melhores para nosso Brasil coisas boas como educação emprego etc ele tem meu voto e não troco por nada sou 13
269850230303381_269973046957766	11	Conte com o meu voto presidente Haddad!!!! Amo Lula nosso eterno presidente da república!!!!!
269850230303381_2343223662385285	6	Lula nôs  sentimos muito a sua o Brasil é a população te aguardando de braços abertos !!!!!!
269850230303381_269945213627216	10	Vç sempre estara no nossos coração lula vç foi u melhor presedente que u brasil teve estaremos sempre contigo e uma pena vç não comcorer as eleição de 2018 😥
269850230303381_269973716957699	11	Os dedinhos dos eleitores de Lula estão coçando, doidinhos para teclar o 1 e o 3, é 13 e ponto!
269850230303381_2203878236568072	9	É verdade a educaçao teve mais faculdades o salario melhorou  e alunos tiveram mais opiçao de estudar.HADAD PRESIDENTE13
269850230303381_269954850292919	10	#LulaLivre
#HaddadPresidente
#ManuelaVice
#OBrasilFelizdeNovo
13❤️13❤️13❤️13
PT/PCdoB/Pros
269850230303381_1063050827210405	6	Ei Lula você foi o presidente que nós paraibanos ê brasileiro sentimos orgulho você Lula têm muitas importância pra nós é com fé ém Deus nosso 13 vai vemcer
269850230303381_869827593220636	6	Eu só 13 .so a favor da educação  .i Di Brasil felis Di novo  .  Dia 7 .vo vota 13. Porque  Eli sim pensa em q precisa .i em qual não precisa .
269850230303381_980269778764300	5	O Lula é uma estrela sempre Alegre multou por nós agora é Haddad vamos apoar ele para ter um Brasil melhor
269850230303381_2203870616568834	8	Fique tranquilo Lula se Deus quiser nós vamos  eleger como presidente o Senhor HADDAD em breve teremos o senhor fora da prisão se Deus quiser
269850230303381_2002615776702708	3	Os índices da educação no Brasil são os piores possíveis...obrigado pt !
269850230303381_248803105836963	8	Bora no 13 porque é o número do povo Brasileiro que vamos fazer a diferença .
269850230303381_269367663705119	5	Tamos  juntos vamos em frente Samos Lula Samos pt Samos hadadd pq Samos Brasil e Samos brasileiros dia 7 de otobro e Lula e hadadd Samos nos nas urnas e não tem pra ninguém
269850230303381_269856730302731	7	Quando começam as atividades de campanha para Haddad aparecer nos jornais???
269850230303381_1945217329105185	3	Se o 17 for eleito só quero v neguinho fugindo do Brasil porcento da ditadura militar por isso sou 13 quero paz investimento e felicidade
269850230303381_244687569721435	2	Chora bebê o Brasil tem que ser comadado pelo ficha limpa cuidado meus irmãos Brasileiros saudações a todos.
269850230303381_418196318706806	3	Tem que sé 13 se nao estamos perdidos é nossa esperança. Pra o Brasil voltar a sorrir
269850230303381_1144330695714933	2	Gente, acorda! Que educação é essa do Brasil onde os professores não podem reprovar o aluno porque se isso ocorrer a escola perde verba federal. Portanto, vivemos uma educação de faz de conta e todos os brasileiros fecham os olhos para esta realidade e estamos formando uma geração que chega ao segundo grau sem saber ler ou escrever. Este é o legado que o PT deixa para nossos jovens. Muito triste 😔
269850230303381_264719291041892	3	Chama que o homem da jeito lula e 13 e o Brasil feliz denovo
269850230303381_196744171097428	1	Si não fes nada enquanto foi prefeito de São Paulo e o gue vai fazer pelo Brasil nadaaaaa
269850230303381_170776000464810	5	É triste 
É emocionante
e ao mesmo tempo Desprezível vê que um judiciário Partidário não cumpre com o juramento de defender a Democracia,
Pois eles não conhecem mas iram conhecer o poder que o Lula tem ao eleger o Haddad mesmo estando preso e empedido de fazer se quer um vídeo falando para o povo que o Haddad representará as suas ideias e o seu povo.
269850230303381_279031586039558	3	Eu Brasil beira apoio o 13 não é o lula vamos apoar o Haddad como presidente do Brasil
269850230303381_270012530287151	5	Sai chinelo, daqui alguns dias tu vai ficar na cela ao lado do teu  chefe !
269850230303381_277235592893535	2	Aí o Lula presidente do Brasil Partido dos Trabalhadores sabe governar Brasil
269850230303381_269949103626827	4	petista vcs ouviram a delação do Palocci oque ele falou da Dilma e lula do falado golpe o lula mandou a Dilma negocia a saída dela com o temer
269850230303381_210499463011285	2	Lula livre  liberdade  para o guerreiro  nada mais justo  estamos com você lula 13 Haddad
269850230303381_2175851665792294	2	Com certeza Addad o brasil precisa continuar lutando pela igualdade!
269850230303381_901804183342146	1	Nossa...!!!!!!!!!!  Será que esse povo mora no Brasil..???????  Coloquem na cabeça o cara é réu..... gente vcs gostam mesmo de viver na chicotada....
269850230303381_265174334116072	2	E isso  vamos herger   o Brasil  novamente ser fez  sorrir  novamente  ..... Lula sempre
269850230303381_2233826536937980	2	Contra fatos primo Jr.não a argumentos,o Lula foi o maior presidente da história do Brasil e o de maior aprovação de todo o mundo superando o Nelson Mandela.
269850230303381_2175711525806308	2	E 13 neles presidente de pobres não loucos de ricos dia 07 e o Brasil e 13 as críticas so fortalecem rumo a vitoria
269850230303381_339214936813351	2	Lula é Haddad  para o Brasil e principalmente o nordeste volta a crescer
269850230303381_2203905183232044	5	olha aí Lucivania Magalhaes meu presidente Haddad é Lula e eu sou 13!!
Somos milhões de Lula, ne Graças Magalhaes?
269850230303381_331924534231912	2	Vamos lá Haddad o Brasil feliz dinovo. Dia 7 e 13 Brasil segue.
269850230303381_269890440299360	15	É o Lula da memória popular.
Viva Lula!
Viva a resistência do povo, do Lula e do PT.
#SomosMilhõesDeLula
#LulaÉHaddad
#HaddadÉLula
#HaddadPredidente
#Votamos13
269850230303381_729676057371519	0	Se isto foi o melhor que o Brasil já teve de governo, então a Venezuela não está tão ruim assim como dizem.
269850230303381_504956819979108	0	Juntas todos nao da nem metade do que roubaram e acabaram com o Brasil,ele esqueceu disso😂😂😂
269850230303381_281515482572638	1	Educação no Brasil é muito Boa! referência mundial, padrão PT
269850230303381_269852130303191	16	Lula é Haddad presidente 13 😘
269850230303381_136337660650816	0	Parece que ele esqueceu , que Lula era o presidente , desta geração confusa.
269850230303381_2181349572129213	4	LI, GOSTEI, POSTEI...

Em uma de suas reuniões, Hitler pediu que lhe trouxessem uma galinha.
Agarrou-a forte com uma das mãos enquanto a depenava com a outra.

A galinha, desesperada pela dor, quis fugir mas não pôde.
Assim, Hitler tirou todas suas penas, dizendo aos seus colaboradores:

"Agora, observem o que vai acontecer".

Hitler soltou a galinha no chão e afastou-se um pouco dela.
Pegou um punhado de grãos de trigo, começou a caminhar pela sala e a atirar os grãos de trigo ao chão, enquanto seus colaboradores viam, assombrados, como a galinha, assustada, dolorida e sangrando, corria atrás de Hitler e tentava agarrar algumas migalhas, dando voltas pela sala.
A galinha o seguia fielmente por todos os lados.
Então, Hitler olhou para seus ajudantes, que estavam totalmente surpreendidos, e lhes disse:
"Assim, facilmente, se governa os estúpidos.
Viram como a galinha me seguiu, apesar da dor que lhe causei?_
Tirei-lhe tudo..., as penas e a dignidade, mas, ainda assim ela me segue em busca de farelos."
"Assim é a maioria das pessoas, seguem seus governantes e políticos, apesar da dor que estes lhes causam e, mesmo lhe tirando a saúde a educação e a dignidade, pelo simples gesto de receber um benefício barato ou algo para se alimentar por um ou dois dias, o povo segue aquele que lhe dá as migalhas do dia."
269850230303381_332133874020496	2	Condenado fazendo campanha de dentro da prisão é coisa do crime organizado! PT NUNCA MAIS !
269850230303381_140113166933716	6	Meu voto é no 13com Lula ou sem Lula é 13é PT é #Haddad é Manuela agora mas do que nunca.
269850230303381_577492652665172	1	Pode 100,00 milhões fala mais partiu Piauí e so dada e lula gente nos que e nosso Brasil feliz de novo e 13 13 13
269850230303381_938501469675482	0	Um presidente que quer tirar a inocência das crianças do nosso Brasil tô fora
269850230303381_269950726959998	3	Também, desde a proclamação da república, nunca tivemos um.presidente preso.
269850230303381_249417909073847	3	Meu voto vai para aquele que não esta envolvido em corrupção 
É defensor da família 
É cristão 
É patrióta
E leva o número 17
Advinha......
269850230303381_169897377235068	0	Se você quer um Brasil horrível como está vote 13
Se quer um Brasil muito melhor vote 17... tchau Brigaduu
269850230303381_269948086960262	7	Haddad foi o melhor ministro para educação. Valorizou os profissionais do magistério eles que não esqueçam
269850230303381_480330332469543	0	Pesquisas atrás de pesquisas apontam Fernando Haddad como o pior prefeito do Brasil. O paulistano está insatisfeito com seu administrador que, de prático...
269850230303381_296567811123037	1	Em cada edição, o Pisa dá ênfase a uma das três áreas. Na deste ano, o foco foi ciências. Em 2015, a nota do país em ciências caiu de 405, na edição anterior, de 2012, para 401; em leitura, o desempenho do Brasil caiu de 410 para 407; já em matemática, a pontuação dos alunos brasileiros caiu de 391 para 377. Cingapura foi o país que ocupou a primeira colocação nas três áreas (556 pontos em ciências, 535 em leitura e 564 em matemática).
269850230303381_2132346053675649	0	Quem acabou com o Brasil quem Orquestrou a Banda das panelas ta melhor Agora    Me ajuda Ai João  Acorda alem de não saber votar não sabe Avaliar Nunca Foi diferente
269850230303381_535775800200941	0	Como o pior prefeito da história de sao paulo, vai ajustar o Brasil???? Só besta acredita...
269850230303381_269952540293150	8	Vamos lá Haddad! Vamos com força pra levar essa no primeiro turno.
#LulaLivre
#HaddadPresidente
269850230303381_269853026969768	19	VOU votar no Haddad
269850230303381_141255980153258	4	Já estou HaddadPTada. 
Haddad, você tem luz própria e quanto mais te conheço mais te admiro. ,#HaddadManu2018
É 13 de ponta a ponta.
#LulaLivre, JÁ!!!
269850230303381_269942636960807	2	Mostra a tua agenda de trabalho na prefeitura de SP. Pro povo ver como vc gosta de trabalhar kkkkk
269850230303381_269983793623358	4	Meu voto é do Ciro Gomes 12,se fosse o Lula eu votava,mas no Haddad eu não voto.
269850230303381_312633536198640	0	Haddad, tem que ter vergonha em falar que a educação está boa! Para de falar mentiras as escolas sucateadas, professores não têm + autoridades de exercer sua profissão pois são humilhados na sala de aula, apanham dos alunos e as autoridades não fazem nada, acabaram com a educação! Fora você, Lula e companhia! VOCÊS NÃOOO E NUCA ++(
269850230303381_315560465912237	0	Vamos trazer de volta aquele Brasil das oportunidades e alegrias.
269850230303381_2177163405635455	2	Será que vamos eleger um poste? Por que na prefeitura foi um poste, e parece que não tem nenhuma vontade de se eleger, triste do povo!
269850230303381_728332424174767	2	Oh surra viu hadad kkkkk jaja eh vc tb pagando pelos seus crimes tb 💚💛💙17
269850230303381_124703438497439	0	Essas pessoas são mal agradecido, esquece rápido, Lula fez muitas coisas boas, foi o melhor presidente do Brasil, voto 13!
269850230303381_2019123465053717	0	Lula foi um dos melhores presidente das história do brasil tem gente que gospe no prato que come ainda vem dar um de certinho
269850230303381_270010580287346	2	Pra fazer kit GLS em vez de ensinar matemática e coisas úteis  e ajudar a quadrilha a se perpetuar?
269850230303381_158479868415482	0	Meu presidente preferido por brasileiros e estrangeiros Lula omelhor dos melhores
269850230303381_1151140451710090	2	A educação acabou, deixaram de ensinar o certo e aprovaram o errado pra não ter reprodução, 
Resultando uma geração que não sabe nem português.
269850230303381_656845944698304	4	Com as pessoas têm que ter consciência porque o Lula ajudou muita gente e Deus vai abençoar Ele vai voltar de novo
269850230303381_248797272504213	2	13 anos de PT chega 
Tiveram muito tempo pra fazer algo 
Vamos dar chance a outros 
Chance pra quem não é corrupto
269850230303381_254956845159974	3	Kkkkkkkkkkkk.... 2019 promete para o seu lado!!! A LAVA JATO TE ESPERA!
269850230303381_341097159796462	2	Não fez mais que obrigação. E foi bem pago pra isso. 
Depois só fez lambança. P.T.nunca mais. 😠😠😠😠😠
269850230303381_525185931278412	0	Já fui eleitora e defensora do Lula.  Fui enganada. Agora vou no 17,  pois quero um Brasil passado a limpo!
269850230303381_244685529721639	2	Melhoraram em que, a educação? Continuamos entre os piores países do mundo área. O PT ao invés de investir na educação de base criou foi bolsas e facilidades para os alunos entrarem em faculdades
269850230303381_324401361455124	0	Não olhe pros defeitos dos outros , olhe também pra obras!; se você não mora no Brasil não conhece nada.
269850230303381_167972697452289	0	Verdade Lula e Haddad são os melhores para ó Brasil urgente para presidente
269850230303381_1040635466138642	0	Dia 07 é 17 Brasil acima de tudo Deus acima de todos muda Brasil muda de verdade.
269850230303381_710701462639823	0	Deve ser por isso que metade dos jovens de que concluíram o ensino fundamental tiraram ZERO  na avaliação do ensino no Brasil
269850230303381_2005720079718539	3	Estou passando aqui para informar que meu candidato esta de licença medica e por isso estou  fazendo a campanha por ele! #BolsonaroSim17
269850230303381_489575568187068	0	O Brasil melhora guardo o PT devolver todo gue foe roubado da nação na verde era todo nasso
269850230303381_1049536598583837	1	#Bolsonaro17 ➡️ NELES #Bolsonaro2018 #Bolsonaropresidentedobrasil
#EleSim
#somostodosbolsonaro #venceno1ºturno
👉👉👉🇧🇷1️⃣7️⃣😎😎😎😎😎👍
269850230303381_2158507921139525	1	Fora do nosso Brasil Lula Addad e todo pt. Se for a vontade do povo honesto e trabalhador pt nunca mais aqui em solo brasileiro.
269850230303381_136339697317279	1	Velho rabugento! Levando o amiguinho para a cadeia com ele já já ...
269850230303381_165691937636734	1	O ministro da patria educadora... a mesma em que 96% dos estudantes do ensino médio não sabem nem o básico de matemática e português... parabéns!
269850230303381_269939173627820	3	Boa noite amigo muita fé em Deus, você vai saí desta situação nós nordestinos, sabe como você é importante para nós!!!!
269850230303381_536734746779148	5	Petralhadas vamos apostar,  é bola na rede....gooooollll,Haddad Presidente!
269850230303381_140137810268191	1	Tem que ter saudades mesmo, era uma roubalheira   danada, acabou agora E 17 neles
269850230303381_467314397106877	1	Kkkkk,você não ganha mais nem pra sindico de zona...,nem que os seus votem em você..
269850230303381_324441354975437	1	O dado mais relevante publicado nesse sábado pela pesquisa do Data Folha é que nada menos que 32% consultados votarão em candidato INDICADO por Lula .  Isso é fato . Está na pesquisa. Não se trata de propaganda.
269850230303381_270106050277799	3	É por isso que vou as urnas 7 de outubro com muito orgulho eleger o time do 13...pq  é esse que faz a diferença
