id	message	like_count
255428838508479_255436611841035	830	Pt no poder 13 anos só fez afundar o Brasil, por que acham que vão mudar agora? Sem sentido!!
255428838508479_255437768507586	375	15/10. Sou professor há 14 anos e peço voto para o professor
Fernando Haddad Presidente!
255428838508479_255452271839469	146	Kkkkkkkkk não engana mais o povo não... o prouni quem criou: O programa foi criado em 1999 durante o governo de Fernando Henrique Cardoso e ampliado no governo seguinte de Luis Inácio da Silva (Lula), sendo sucessor do Crédito Educativo, criado em 1976 pelo regime militar.
255428838508479_255437081840988	185	Parabéns, professor Fernando Haddad! Sua ponderação será nossa resposta ao obscurantismo e ao ódio.
#HaddadSim
#Haddad13
255428838508479_255438451840851	140	parabéns Fernando Haddad hoje é dia dos professores. Você como candidato representa hoje a luta contra o fascismo, contra a morte e criminalização das comunidades. Estamos juntos nessa! #haddad13presidente #manuela13vice #andrade13presidente
255428838508479_255435671841129	267	Esqueceu de mencionar os 32 processos por corrupção!!!
255428838508479_255436435174386	112	Feliz Dia dos Professores, meu Presidente. Obrigada por lutar por um país melhor e por tentar salvar o Brasil do caos e do facismo. Continue firme nessa luta por nós, do outro lado tentamos combater o ódio e a desinformação! ❤️
255428838508479_255437448507618	100	Parabéns Prof Fernando Haddad por tudo que fez pela educação Brasileira #haddadpresidente
255428838508479_255445168506846	93	Estou quase acreditando que os professores estão precisando de uma reciclagem
255428838508479_255443511840345	70	Se ele deixou são Paulo entregue as baratas, imagina oq ele pode fazer com o país?
255428838508479_255438621840834	68	feliz dia, professor Fernando Haddad! 
por mais força e sabedoria!!!  por você e Manuela D'Ávila na presidência!!! #pelademocracia #professorpresidente #haddadsim #manunojaburu
255428838508479_255436571841039	68	"Parabéns professores"

Feliz aquele que transfere o que sabe e aprende o que ensina.

 - Cora Coralina
255428838508479_255442145173815	82	Parabéns Professor Fernando Haddad.
Teremos um Professor Presidente.
255428838508479_255446688506694	57	olhando aqui vejo como ainda existe gente alienada em pleno século da informação  kkkkk
255428838508479_255436555174374	60	FIES sem fiador , quebrou o FIES  e  financiou os donos de faculdade particulares , é um irresponsável quando fez isto.
255428838508479_2148043718790391	54	o PT foi tão bom pro trabalhador que o salario minimo é menor que o auxilio reclusão
255428838508479_255456608505702	53	Me formei em jornalismo pelo Prouni. Obrigada, Fernando Haddad isso fez toda a diferença na minha vida e das minhas filhas. A Educação é libertadora. Parabéns pelo seu dia.
255428838508479_255443761840320	36	Bandeira do Brasil e com a voz de um nordestino na propaganda.... ta ai duas coisas que voces nuncam apoiaram... o povo acordou pt 👉👉
255428838508479_255436528507710	43	FELIZ DIA DOS PROFESSORES. PARABÉNS HADDAD. estamos juntos com vc, a Bahia em peso.
255428838508479_255444478506915	45	Feliz dia, Professor Fernando Haddad! 👨🏽‍🏫

#HaddadPresidente
#HaddadSim
#Haddad13
255428838508479_2148036422124454	39	Votar 13 é a mesma coisa que votar pcc. Vamos ser governados de dentro da cadeia kkkkk
255428838508479_255438938507469	38	Querido Fernando Haddad, é preciso estar atendo à comunidade surda e colocar tradutor de libras em todos os vídeos. Aquele outro candidato tem feito isso, e mais muitos surdos tem feito vídeos apoiando e defendendo aquele outro candidato. Agora imagine, muitos na comunidade surda não tem plena alfabetização, tem dificuldade de ler e entender textos, então as informações que eles tem chegam na sua grande maioria pelos vídeos em Libras. É preciso incluí-los e dar a chance que eles conheçam o seu plano, as suas propostas uma outra visão que não só aquela do outro candidato.
255428838508479_255447511839945	38	Sou professora e hoje gostaria de parabenizar você #fernandohaddad pelo dia dos professores. Por sua coragem! E dignidade ! Força professor!
255428838508479_255446525173377	37	Parabéns  pelo seu dia, Professor Fernando Haddad! #HaddadSim
❤🌹💃🏿
255428838508479_255459108505452	36	Parabéns professor Haddad! O melhor ministro da educação que o Brasil já teve! #professorhaddadsim
255428838508479_255449098506453	45	... Enquanto isso o Ensino Fundamental ficou no esquecimento... "Belo" Ministro da educação! Affff
255428838508479_255458428505520	33	13 anos de poder e uma crise econômica profunda .. 
O que vão fazer para melhorar isso que não fizeram nos últimos 13 anos ?
Vão falar que a culpa é do temer em 2 anos de mandato ?

Kkkkk

Esse marmita é um comédia msm
255428838508479_255445965173433	31	Professor Fernando Haddad, gostaria de cumprimentá-lo pelo seu dia. Deus lhe abençoe e que alcance a vitória com muita honra.
255428838508479_255435495174480	22	Feliz Dia dos Professores ... Presidente Haddad ... tamo junto !!!
255428838508479_255450235173006	30	Parabéns Professor Fernando Haddad! Por um Brasil Democrático. #HaddadPresidente
255428838508479_255456678505695	27	Grande político, Fernando Haddad, o qual foi achincalhado por elaborar projetos aos menos favorecidos quando prefeito da grande metrópole São Paulo! Sou sua fã desde a época! Parabéns, mestre Haddad!
255428838508479_2148041202123976	25	Professor Fernando Haddad, meu futuro presidente, eu espero que nosso dia seja o prenúncio de nossa vitória! Parabéns para você que é professor, parabéns ao Brasil que optará pela educação!!!
255428838508479_255443738506989	21	Parabéns professor Fernando Haddad!! O Brasil precisa de um professor para administrá-lo!!!
255428838508479_1116298355186318	22	PARABÉNS, PROFESSOR FERNANDO HADDAD! #haddadpresidenteprofessor
255428838508479_2148041982123898	25	Uma pergunta como o senhor vai combater a corrupção se responde a mais de 30 processo
255428838508479_255439288507434	19	Parabéns Haddad...vamos na luta a favor da educação!
#haddadsim
255428838508479_255453215172708	24	Parabéns pelo nosso dia Professor Fernando Haddad! A educação e o diálogo são os únicos caminhos possíveis para salvar o país! Obrigado por todo o seu esforço em transformar o Brasil pela educação! Um forte abraço!
255428838508479_1116301685185985	18	Se ele é mestre em economia não consegui ser um bom gestor na prefeitura de São Paulo!!!!
255428838508479_255444188506944	25	PARABÉNS Professor Fernando Haddad, agradecemos a sua determinação e perseverança na luta pelos direitos democráticos de nossa nação!13HADDAD
255428838508479_255441771840519	24	Parabéns professor e futuro presidente dessa nação tão grande e ainda tão sofrida 
Minha reverência ao senhor por tão bela profissão
👏👏👏👏👏
255428838508479_255452461839450	23	Parabéns, Fernando Haddad!!! Muito amor, coragem e sabedoria a você e a todos nós, professores 🙏💐🌻
255428838508479_2148036545457775	25	Parabéns, prof Fernando Haddad! Meu voto é seu, para que possa contribuir ainda mais com a educação do país! #Haddadsim #manunojaburu
255428838508479_255454448505918	20	Meus parabéns Professor Fernando Haddad e muito obrigado pois com sua atuação no Ministério da Educação com a criação do ProUni tive a oportunidade de me formar em engenharia civil. #adade 13
255428838508479_255448521839844	18	Parabéns Haddad!! Estamos contigo pela educação!!! 👏👏👏❤
255428838508479_255453431839353	20	Fez mesmo na prefeitura de São Paulo 
Haddad radar ...mas nada. Deixou 500 mil pessoas na fila de exames..... parabéns
255428838508479_255441868507176	16	Além  dessas qualidades e virtudes, possui um senso  ético  admirável e nos transmite segurança.
Boa educação  e bons princípios. É  a hora da virada e nova chance de dar a volta por cima! Corrigir erros e seguir avante promovendo um bom governo.
Apoio sem dúvida!
255428838508479_255439301840766	23	Parabéns Professores do Brasil ! Força e coragem Professor Fernando Haddad 📚✏
255428838508479_255439495174080	22	Feliz dia dos professores, prof Haddad! Queremos 📚livros e educação e não armas! Parabéns!
255428838508479_255448555173174	19	Feliz dia do professor, querido Fernando Haddad!!!    Que felicidade o senhor como nosso futuro Presidente!!!    Viva #Haddad13
255428838508479_244750579536619	14	Feliz dia do professor Fernando Haddad! Vamos a luta por uma educação de qualidade.
255428838508479_2148050092123087	14	PARABÉNS ao professor Fernando Haddad, pelo Dia do Mestre.

#HaddadPresidente
#HaddadSim
#Haddad13
255428838508479_2148034798791283	17	ProUni,q foi criado no governo FHC. Só desinformado pra achar que foi o PT q criou
255428838508479_1116301558519331	25	Pessoas com imensa capacidade intelectual, que tiveram finalmente uma oportunidade através desse programa! ♥️ #HaddadSim
255428838508479_255448601839836	15	Parabéns, Professor Fernando Haddad!
Uma homenagem de um professor para um professor!
Mais livros, menos armas!
255428838508479_255441651840531	16	Professor Fernando Haddad. Parabéns pelo nosso dia. Assim como você escolhi ser educadora, por compreender que através da educação é que transformamos vidas!
255428838508479_255441278507235	13	Passando por aqui, só para desejar ao meu candidato, um feliz dia dos professores 💚💛💙
255428838508479_255440001840696	15	Parabéns professor e futuro presidente da nação pelo dia de hoje. O povo brasileiro precisa de ensino com pensamento crítico e não de discurso de ódio.  Grande abraço
255428838508479_255443758506987	15	Senhor presidente da República, qual é a sua proposta para combate que os marginais determine os crime de dentro da cadeia.
255428838508479_255441021840594	14	A luta é grande, eu sei, estou trilhando o mesmo caminho, o caminho é tortuoso e às vezes cheio de espinhos, mas jamais desistam, pois vocês são as bases de sustentação da nossa sociedade. Feliz Dia do Professor Fernando Haddad!! ❤️
255428838508479_2148034612124635	13	Minha filha faz parte desses dois milhões que está fazendo faculdade pelo ProUni, aqui em Paulo Afonso Bahia, Nordeste, parabéns pelo investimento na educação, sou 13.
255428838508479_255454635172566	14	Parabéns pelo seu dia, Haddad! Eu quero um professor como presidente do Brasil!
#Haddad
255428838508479_244745882870422	12	Parabéns,, professor Haddad!!!! Mais livros menos armas. Sei do que estou falando, pois sou professora!!! O Haddad foi o ministro que mais fez pela educação nesse imenso Brasil
255428838508479_255446521840044	12	Parabéns, pelo excelente professor que você é. O Brasil merece você como presidente!
255428838508479_255438015174228	11	Parabéns Professor Fernando  Haddad, muita luz e proteção divina em sua caminhada
255428838508479_2148062195455210	18	Voto nele sim to fazendo faculdade graças ao Prouni ...
Os ricos estão c medo das familias mas pobres ocuparem o lugar deles
255428838508479_1116302655185888	10	PARABÉNS Professor, muito orgulho de vc ! A melhor profissão do mundo, Acreditamos em vc !! Sua garra vai ajudar a todos os brasileiros.
255428838508479_255459325172097	11	Parabéns professo devo a você por meu filho dr andreson hoje pela  pró uni   faculdade uni nove meu filho bolsista hoje e advogado só tenho agradecer ao governo lula parabéns ao seu gorveno
255428838508479_2148029672125129	13	Dar licença com seu ensino a distância, queremos passar com nosso ensino médio federal. #HaddadSim #haddadpresidente
255428838508479_255437838507579	10	A base de toda conquista é o PROFESSOR. A fonte de sabedoria, um bom PROFESSOR.
Em cada descoberta, cada invenção, Todo bom começo, tem um bom PROFESSOR.

No trilho de uma ferrovia, um bom PROFESSOR. No bisturi da cirurgia, um bom PROFESSOR.
No tijolo, na olaria, no arranque do motor, Tudo que se cria, tem um bom PROFESSOR.

No sonho que se realiza, um bom PROFESSOR. Cada nova ideia, tem um PROFESSOR. O que se aprende, o que se ensina, 
Um PROFESSOR.

Uma lição de vida, uma lição de amor, Na nota de uma partitura, 
No projeto de arquitetura,
Em toda teoria, tudo que se inicia,
Todo bom começo, tem um bom PROFESSOR.

Parabéns PROFESSOR Haddad.
255428838508479_2148175398777223	9	Ó  respeito  à cima  dê tudo  isso é muito  importante    Pará um presidente  i  isso    Haddad  têm  dê  sobra respeito por ó  próximo
255428838508479_244761459535531	12	Parabéns professor Fernando Haddad!!! Vc é um mestre q nos orgulha e nos faz ter esperanças de um pais melhor e mais justo. Obrigada pelo que já fez pelo nosso povo. Vamos em frente!! #Haddad13
255428838508479_2148038252124271	10	Parabéns professor! Te admiro muito.. precisamos de você <3
255428838508479_1116297901853030	8	Assalto que teve aqui em Manaus  pessoas como escuto.. Não foi resolvido com livros ..🤫
255428838508479_463249357415719	6	Kkkk kkkk essa é Boa
Fernando Haddad preparado para governar o país kkkk kkkk
Não prestou pra governar são poulo
255428838508479_2148048285456601	9	No governo do Haddad os policiais não teram armas, e sim livros e flores! 👏😂 👏😂 👏😂
255428838508479_260880754571966	4	Haddad vai mudar o Brasil jkkkk , esse era o discurso da Dilma e do Lula anos atrás
255428838508479_244771119534565	4	Boa tarde PROFESSOR Fernando Haddad 　 Desejo que este dia seja muito feliz, pois como o Senhor falou, sempre quis ter uma escola, mas agora é Professor com muita honra. Desejo que o Senhor seja o Presidente da República e inspire milhões de Professores, melhorando a qualidade de ensino, mais inclusão, com alunas nas salas de aula, em ambiente bom para se preparar para o futuro, com merenda como deve ser, pois muitas crianças tem na merenda escolar sua única refeição por dia.
255428838508479_1116309985185155	7	Para os nordestinos o discurso é outro. Diz que vai facilitar a liberação de armas pq o discurso pro- armas pegou por la. Ja tirou a cor vermelha da propaganda, fez Manuela Davila virar crente em Deus e (pasmem) esta ate condenando o regime terrorista do Maduro! Vale tudo pelo poder
255428838508479_487851961692730	10	O bem sempre venceu o mal. Haddad presidente do Brasil 13
255428838508479_255443118507051	8	Parabéns Haddad, hoje é o dia dos mestres de todas as profissões. Parabéns pelo ser humano que és...
255428838508479_1116304818519005	11	Haddad desafio vc ser homem o suficiente pra ir lá no Rio de Janeiro combater a violência com livros. E faz uma live pra nós ensinar.
255428838508479_255436595174370	8	Parabéns professor Haddad !!! Que sua luta pela educação continue sendo de vitórias !! Saudações pelo dia de hoje e que Deus o abençoe !! Forte abraço.
255428838508479_255446618506701	8	Feliz dia, #professorHaddad.... Que sejas muito feliz! 🌷🙌🏻
255428838508479_178779916333544	3	A cidade de São Paulo reprovou  o então prefeito Professor Fernando Haddad. Só testaram processos por vários crimes.
255428838508479_487886281689298	5	Parabéns professor Fernando Haddad, é melhor Jair se acostumando, o foro privilegiado acabou, vai ter que voltar para a sala de aula na cadeia, já tens um aluno para alfabetizar em Curitiba...
255428838508479_1116299785186175	7	Kkk a escola  técnica  da minha cidade só funciono 1 ano depois fechou  por falta de verbas kkk  hj e depósito  de dengue parabéns  governo do pt!
255428838508479_2148047882123308	6	2 milhões de jovens formado e sem mercado de trabalho o que adianta culpa do lula e sua turma .....#17bolsonaropresidente
255428838508479_255446965173333	8	Parabéns professor #Haddad❤❤você é o presidente que o Brasil precisa para a população voltar a ser feliz de novo! Que o amor e a paz possa vencer o ódio, a violência, o preconceito e a intolerância!#Haddadpresidente❤
255428838508479_244788189532858	7	Tem pessoas mesmo vendo a verdade não aceita. PT  nunca mais me traiu, enganou, destrui o meu voto de confiança.
255428838508479_255442048507158	11	Parabéns pelo dia do professor, Haddad! Um país se constrói com conhecimento e livros, não com tiros e correntes de WhatsApp. #Haddadsim
255428838508479_1116291348520352	7	Parabéns Professor pelo seu dia. Que Deus o abençoe e vamos seguindo por um Brasil com livros e sem armas. 😘
255428838508479_255459778505385	8	Faltou uma semana na Prefeitura por renite, imagina se fosse uma facada.
255428838508479_1116291235187030	7	Senhor presidente da República o que é quer, o senhor vai fazer para combater o crime organizado de dentro da cadeia.
255428838508479_2148036805457749	5	Parabéns Professor!!! 

MELHOR PREFEITO DE SP!!!
MELHOR MINISTRO DA EDUCAÇÃO!!!!
255428838508479_487789818365611	6	Parabéns Haddad e assim q se deve governar o Brasil com educação.
255428838508479_1116316338517853	5	Parabéns, professor Fernando Haddad, você é um grande guerreiro, não foge a luta!  Professor do coração Brasileiro, parabéns!♥️✌️
255428838508479_255439615174068	5	Cada post a favor de #Haddad13, curta, comente com a hashtag #Haddad13 e compartilhe. Vamos virar o jogo do algoritmo
255428838508479_255439211840775	6	Parabéns pelo dia de hoje, mestre querido! Sonho maior é tê-lo na presidência do nosso País. Haddad 13!!!!
255428838508479_244792542865756	4	Eu sou psicóloga e o parabenizo Professor Fernando Haddad pelo seu dia !!!! #HaddadSim #Haddad13
255428838508479_255456615172368	6	Boa tarde, professor Haddad! Vamos de 13 pela educação do Brasil...uhuuuu Feliz dia dos professores!!
255428838508479_487784455032814	6	13 e adadad mosonario 28 anos nuca vi hum projeto de le é aprimeira veis qeu u ifero abrio as portas pra ele vim u noso pais puriso meu voto é HADDAD é 13
255428838508479_255450268506336	8	Parabens meu presidente!  Sua profissao e como a minha:  a melhor pro mundo!
255428838508479_255452108506152	8	Saudações... Fiz um poema em homenagem aos professores e Haddad... Onde e como posso fazer para chegar a ele, equipe Fernando Haddad? Obrigado
255428838508479_1116290461853774	5	Parabéns pelo seu dia professor!!! Sou fonoaudióloga formada pelo ProUni.... obrigada pelo esforço na elaboração  e cuidado com esse projeto!
255428838508479_255438258507537	9	Parabéns ,ao mestre com carinho  ❤. Só uma boa educação pode salvar uma pátria. #Haddad13
255428838508479_255452675172762	7	Parabéns  professora pelo seu  dia!! Futuro  presidente desta Pátria  querida.
255428838508479_255445405173489	7	Parabéns pelo dia do professor, querido #Haddad13! Deus nos abençoe.
255428838508479_244766316201712	4	Quem quiser pode verificar os resultados no acesso a educação dos mais pobres no nível superior. Os dados estão disponíveis no site do IBGE. Eu entrei em 2012 na UFRJ e acompanhei com meus próprios olhos o processo de transformação do perfil socieconômico e racial dos estudantes. Grande oportunidade que tivemos de poder conviver e aprender com nossas diferentes experiências de vida! #Haddad13

https://scontent.fgig4-1.fna.fbcdn.net/v/t31.0-8/26233329_10209728505844004_2533980834770275458_o.jpg?_nc_cat=106&oh=42a3146b841af6f68b831c46d47ad7c2&oe=5C5D8301
255428838508479_244745826203761	10	Parabéns professor Haddad!! Estamos com você! !! Quem tem educação nao precisa de agressão. Você é a nossa esperança para um Brasil melhor e mais humano! 💗
#HaddadSim #HaddadPresidente
255428838508479_550891855369820	2	Isso mesmo vamos votar. Fernando Haddad sim 13 nosso Presidente da República do Brasil
255428838508479_255443861840310	6	Sua Arione Mota
Sou professora e evangélica.  Quero parabenizar o professor Haddad neste dia. Que Deus te abençoe.
255428838508479_255450068506356	4	Parabéns pelo seu dia professor Haddad!
#MaislivrosMenosarmas
255428838508479_303263620266651	2	Obrigado Professor Fernando Haddad por mostrar a São Paulo como se destrói um estado agora fica difícil destruir um país
255428838508479_255441291840567	8	Ao mestre com carinho. Parabéns aos Professores do BRASIL, em especial ao PROFESSOR FERNANDO HADDAD candidato a presidência da república. Um abraço.
#ProfessorHaddadsim. 13
255428838508479_487779721699954	2	Feliz Dia do Professor, Fernando Haddad! que possamos multiplicar cada vez mais as sementes plantadas quando você foi ministro!
255428838508479_899295356930587	2	Nunca deixe pra manhã o que você pode fazer hoje porque o amanhã será tarde demais vote Fernando Haddad 13 vamos deixar o ditador de lado
255428838508479_255445765173453	5	Feliz Dia Dos Professores meu Presidente. Parabéns para tod@s nós Professoras e Professores que nos orgulhamos de nossa profissão, por sermos agentes transformadores  de vidas, pois no nosso dia a dia fazemos com que nossos alunos acreditem que são sujeitos  históricos para um mundo melhor e mais justo caminhando para o bem e para o belo.❤️💙💕😘
255428838508479_244793226199021	7	Meu filho é um ótimo advogado, graça ao FIES , obrigado Haddad ,sou 13
255428838508479_255453368506026	7	Parabéns, querido, pelo seu dia!
#Haddad13 #MaisLivrosMenosArmas🇧🇷❤️📚🌷
255428838508479_487819438362649	6	O Brasil precisa de livros de mas  educação  mais escolas não de armas já basta oq tem por isso e 13  e pt
255428838508479_1116304911852329	5	Parabéns, presidente. Feliz dia do professor, pra você e pra todos os professores.
Que a educação possa ser, em um futuro muito próximo, motivo de muito orgulho para o nosso país e que os professores sejam muito bem valorizados e honrados.
Obrigada à todos que se dedicam a esta profissão linda 💜
#HaddadSim
#Haddad13
#HaddadProfessor
#HaddadPresidente
255428838508479_255448341839862	6	Parabéns pelo dia do professor. #Haddadneles #Haddad13 #HaddadPresidente
255428838508479_255439845174045	7	Feliz dia! Que o povo acorde e vc possa ser o presidente que vai preservar nossa democracia!!! #Haddad13
255428838508479_255459838505379	6	Com muito carinho ao #ProfessorHaddad pelo seu dia🙏🌻🌺🌼🏵️🍀🌹.🙏
#HaddadPresidente💚
#Haddad13💛
#HaddadSim💙
255428838508479_255452478506115	6	Parabéns, professor!!! Muito orgulho do seu trabalho!!!

#HaddadPresidente
#HaddadSim
#Haddad13
255428838508479_2148050025456427	4	Um versinho p vcs!
Batatinha qdo nasce espalha rama pelo chão
Jairzinho presidente e Haddad na prisão.
#paz
255428838508479_1116318111851009	6	#HaddadPresidenteProfessor
Parabéns ao nosso mestre professor! Agora vai se dedicar como melhor presidente! #Haddad13
@Haddad
255428838508479_255452408506122	4	DECALOGO DE LENIN
(SEUS DEZ MANDAMENTOS)

A doutrina de Lenin é fundamentada no dez mandamentos da ideologia ditada por ele mesmo em 1917; veja a seguir.
1° Corrompa a juventude e dê-lhe liberdade sexual; 
2° Infiltre-se e depois controle todos os meios de comunicação; 
3° Divida a população em grupos antagônicos, incentivando as discussões sobre ações sociais; 
4° Destrua a confiança o povo em seus líderes; 
5° Colabore para a derrocada dos valores morais, da honestidade e da crença nas promessas dos governantes; 
6° Colabore com o esbanjamento de dinheiro público, coloque em descrédito a imagem do País, especialmente no exterior; provoque o pânico e o desassossego na população e, por meio da infiltração, destrua a confiança do povo em seus líderes; 
7° Provoque greves, mesmo ilegais, principalmente nas indústrias vitais do País; 
8° Promova distúrbios e contribua para que as autoridades constituídas não as coíbam; 
9° Procure catalogar todos aqueles que possuem armas de fogo para que sejam confiscadas no momento oportuno, objetivando dificultar ou impossibilitar qualquer resistência ou reação; 
10° Fale sempre em *DEMOCRACIA* e em estado de direito, mas, tão logo haja oportunidade,  *ASSUMA O PODER, SEM QUALQUER ESCRÚPULO*.

Trecho do livro de Fernando Haddad *EM DEFESA DO SOCIALISMO* que espelha a atual estratégia de dominação do PT.
255428838508479_244844109527266	3	Parabéns professor Fernando Haddad estou contigo e 13 neles
255428838508479_255448828506480	6	Parabéns pelo seu dia professor!!! Nós queremos educação pública de qualidade, acessível para todos!!! Chega de violência, eu quero educação!!! #HaddadPresidente
255428838508479_255459271838769	5	FELIZ DIA DOS PROFESSORES A TODOS PROFESSORES QUE TRABALHAM COM EXCELÊNCIA, MENOS PRO HADDAD.
255428838508479_2148253342102762	4	Monte de professor apoiando alguém que não fez nada pela educação ,e sim causou o caos nas sala alunos batendo em professor e professores que não ensinam ao nada
255428838508479_255456548505708	6	Parabéns Haddad! Louco pra te ver tocar violão na rampa do Planalto! 😍 #HaddadSim #Haddad13 #AgoraÉHaddad
255428838508479_1116303698519117	6	"Eu quero a esperança de óculos, um filho de cuca legal..." E isso só vou ter com Haddad no governo.
255428838508479_255455221839174	6	PARABÉNS PELO DIA DOS PROFESSORES TAMO JUNTOS HADDAD PRESIDENTE VEC MANU PARABÉNS
255428838508479_487900128354580	2	Só vejo postagem do que Haddad fez como ministro da educação, e como prefeito de São Paulo, o que ele fez? Pq não postam o que ele fez?
255428838508479_1116299708519516	4	O cara e.professor o cara considera funk cultura foi prefeito de São Paulo nunca fez porra nenhuma esse é preparado para ser presidente fala que vai desafogar o sistema prisional só ser piada
255428838508479_255448061839890	5	Indignação de um universitário endividado!

