id	message	like_count
"Mas, quanto aos tímidos, e aos incrédulos, e aos abomináveis, e aos homicidas, e aos que se prostituem, e aos feiticeiros, e aos idólatras e a todos os mentirosos, a sua parte será no lago que arde com fogo e enxofre; o que é a segunda morte.

*Apocalipse 21:8*
347058056038010_327329998032186	0	Credo!! Parece que tá baixando espirito de porco nesse pessoal!!kkkkkkkkk
347058056038010_442640429592516	0	O fim desse incircunciso que falou tal atrocidade
 contra um ser supremo tende a ser horrível!!!
Com DEUS não se brinca!!!
347058056038010_347068966036919	0	è capitao... só B.o atras de b.o essed haddad ai kkk! Eu sou #B17 sehloko esse brasil precisa mudar já
347058056038010_334598253772298	0	Jair Bolsonaro, lembre-se dessa frase caso muitos gostem de falar mal de ti.

E disse também esta parábola a uns que confiavam em si mesmos, crendo que eram justos, e desprezavam os outros:

Dois homens subiram ao templo, para orar; um, fariseu, e o outro, publicano.

O fariseu, estando em pé, orava consigo desta maneira: ‘Deus, graças te dou, porque não sou como os demais homens, roubadores, injustos e adúlteros; nem ainda como este publicano.

Jejuo duas vezes na semana, e dou os dízimos de tudo quanto possuo’.

O publicano, porém, estando em pé, de longe, nem ainda queria levantar os olhos ao céu, mas batia no peito, dizendo: ‘Deus, tem misericórdia de mim, pecador’!

Digo-vos que este desceu justificado para sua casa, e não aquele; porque qualquer que a si mesmo se exalta, será humilhado, e qualquer que a si mesmo se humilha, será exaltado”.

(Lucas 18:9 – 14)

Espero que seja nosso presidente, porque não aguento mais o PT mandar no país.
347058056038010_690711404644560	0	Como Pode isso não tem respeito nem Por Jesus depois querem ser respeitado o Malddad adora isso depois vai na missa para dizer que é Cristão #ELESIM17 #ELESIM17 #ELESIM17 #ELESIM17 #ELESIM17 #ELESIM17 #ELESIM17 #ELESIM17 #PTNÃO #PTNÃO #PTNÃO #PTNÃO #PTNÃO #PTNÃO
347058056038010_327289904702862	1	Muito triste ver isso na página de um candidato. Vamos acordar. O caminho não é o ódio. Qual é a proposta para conviver com gays etc? Eu não entendo mais nada. É curar? Trancar dentro de casa ou matar? Não teremos mais gays? Sempre existiram... sempre. Ou antes eles não existiam? Tenho 44 anos e sempre vi colegas, amigos e familiares gays. A diferença que eles ficavam dentro de casa, não podiam assumir, eram tristes e discriminados. Tenho um tio avô que nunca casou e nunca assumiu. Triste de ver.
347058056038010_442687329587826	0	Chega doer o coração vendo um vídeo desse,não podemos aceitar isso,cada um tem sua religião,respeitando sempre a todos pois não somos todos iguais..mais vim um cara desse e falar isso de Jesus isso é demais..#forapt não admitimos isso jamais.B17 urgente
347058056038010_532027863891374	0	Pra votar no Pt com tudo que já foi provado, a pessoa tem que ser muito mal caráter e conivente com toda a putaria!
347058056038010_1842932952481345	0	Eles ate estavam de boa enquanto enganavam o povo com suas mentiras.  falavam horreros do Bolsonaro e chegaram ao segundo turno, ate ai, tudo bem. Quem nao tem carater usa de meios baixos e sordidos para confundir o povo. Agora faltar com respeito ao Senhor Jesus é demais, alem de perder as eleicoes ficaram demoralizados, Deus cobrará por essas afrontas, com Deus nao se brinca. Deus ē amor  mas, tb é justica. #17neles.
347058056038010_327287778036408	0	Jesus pode ser o que quiser. Alias, somos feito a imagem e semelhança de Deus. Deus é amor. Jesus é amor. Não vi o video completo mas ele poderia estar se referindo a um ser humano de nome Jesus... Não vejo problema aqui. MAS VEJO PROBLEMA SE CHAMASSE JESUS DE CORRUPTO!
347058056038010_183938052502568	0	Quem falou foi o amigo dele não ele, se você tiver um amiga rapariga e obrigado vc ser também? Não né então isso não interfere em nada contra o Haddad
347058056038010_247253105972510	0	Como o ser humano pode ser tão baixo assim. O pior ainda está por vir, pessoas apoiando um louco desse. Só Deus pra ter misericórdia.
347058056038010_671644506554603	0	Compra de voto URGENTE. Denúncia, estão dando 50 reais para votar no Haddad em ARACAJÚ.
ESTÃO DENUNCIANDO NA INTERNET
347058056038010_248576695832271	0	Essa é a turma do PT que alguns da Igreja Católica apoiam. Eu sou católico e posso dizer isso. Essa figura aí, que disse esse absurdo, foi muito criticada aqui no meu Estado após esse triste episódio. Não era para menos, pois foi realmente algo deplorável.
347058056038010_327285091370010	1	Todos os cristãos precisam ver isso
347058056038010_347061292704353	0	Ridículo!Tamo junto capitão, ninguém falou sobre o kit gay nos debates, é preciso que isso seja falando
347058056038010_100448030932424	0	Olha aí a estratégia do PT, se passar por apoiadores do Bolsonaro, agredir as pessoas nas ruas para denegrir a imagem dele. 🤔
347058056038010_347072372703245	0	Na moral , pode falar oq q quer mais sem desrespeitar as pessoas e o elas acreditam , falar desrespeitar a religião das pessoas e muita falta de vergonha na cara velho
347058056038010_532027680558059	1	Não caí nesse joguinho do Haddad não. Se preocupe apenas em apresentar propostas, isso vai dar um diferencial gritante entre vocês dois, prove ao público ser um homem mais preparado e mais maduro politicamente falando. Se mostre capaz de ocupar o cargo de chefe do executivo, o Sr. tem muito potencial, explore ele ! Use o tempo de "molho" pra saber expressar por meio de argumentos como aplicar as propostas do seu plano de governo, a fim de se mostrar mais preparado,qualificado que o Haddad. Até pq ataques de cunho moral não surtem efeitos expressivos, o povo sabe que PT é moralmente falido, ataca na raiz do problema, erros nos governos passados, erros no plano de governo atual, vai incomodar mais ! Forte abraço Presidente !
347058056038010_183773445852362	0	Uma tremenda falta de respeito com Cristo. E não vem com essa de mudar as cores de vocês para verde e amarelo, porque ninguém vai engolir isso. A cor da bandeira de vocês é vermelha, de comunismo, de guerra, de sangue de inocentes. A bandeira de vocês jamais será verde e amarela.
347058056038010_347059086037907	4	Fala sobre as fraudes que aconteceram DOMINGO!!!!!!!!!!!
347058056038010_532028747224619	1	Os que acontece com essas pessoas que fazem isso ? Em qualquer outro país estariam todos presos pois eles não querem que faltem com respeito a eles e por que podem fazem com as outras pessoas ? Pq não respeitam o próximo ? Pq não entendem que o direito do outro acaba quando o do outro começa ? Eles não tem limites , não aceitam certo e errado !  Olha que DEUS SALVE O BRASIL pq se acontecer de o PT ganhar vou embora do país seja lá para onde der de ir.
347058056038010_278114126149402	0	Este topo de gente só pode ser PT.  Jesus é filho de Deus. Bolsonaro para presidente em defesa da nação.
347058056038010_243696626284391	0	Rapaz mais onde o PT levou a cultura religiosa brasileira...e me estranha a CNBB receber esse cara
347058056038010_247359325961888	0	cavalo de satanás desculpe minha opiniao vamos derrubar isso nas urnas ñ sou homofobica mas sou serva do deus altissimo
347058056038010_532037503890410	1	Nosso Presidente querido, não faça o mesmo q seu adversário, nao poste nada contra ele pq eles é tão sujo q cai com as proprias mentiras, o SR. não precisa disso, seu unico adversário é a fraude nas urnas com isso sim devemos nos preocupar e procurar instruir o povo de como proceder.
347058056038010_442608859595673	0	Maligno? Eu sou a Justiça! Sou o homem que salvará os oprimidos. E serei o Deus de um  novo mundo, um mundo ideal! Aqueles que se opõem a Deus, estes, sim, são malignos!
347058056038010_671686939883693	0	Gostei! É assim que se convence o povo do Nordeste, conservador e religioso em sua grande maioria.
347058056038010_617429551988333	0	Mães choram porque não tem comida para dar aos seus filhos no interior do Maranhão.

O que o PT fez pelo Nordeste em 16 anos de governo? A pobreza, fome, sede e miséria governa o povo nordestino.
347058056038010_291961554961201	0	SER GAY NAO TEM NADA DEMAIS,NINGUEM ESCOLHE SUA OPCAO SEXUAL. Hoje eu faco bicos esta dificil um servico fixo em uma loja supermercado moro com os meus pais nao tenho dinheiro pra morar sozinho meu pai quando bebe algumas vezes me agride,nao posso fazer nada pois a casa nao e minha   quando contei pra ele que era gay me agrediu tirou sangue da minha cabeca fui na santa casa levar ponto,tive depressao na epoca perdi meu servico  tratei tres anos ja tive ate comercio de lanches depois fui roubado e fechei na epoca hoje sofro pra conseguir um emprego fixo e ainda ter que conviver  em um lar machista e ser agredido muitas vezes,nao tenho nada contra o bolsonaro,tomare caso ganhe nao seja preconceituoso  pois gay tambem e gente e ninguem e gay por que quer !!!!!!!
347058056038010_2093520290680137	1	Fake news capitão! Tem vergonha na lata não. Está fugindo do debate. Diz que é muito macho, da tiro mas está correndo de medo!🤣🤣🤣🤣
347058056038010_347061032704379	1	Ser gay não dá direito de agredir a religião dos outros. Da mesma forma que a religião não dá direito de agredir ninguém.
347058056038010_532043563889804	0	Que vergonha jair, para de postar fakesnews cara, isso e dublagem, isso não condiz, a fala não condiz com movimento do corpo, e nem com a expressão do público. Uma vergonha pra você descer tão baixo, para de atacar seu adversário e vai para os debates! Quem sabe mudamos a opinião!
347058056038010_1145198368953695	0	Democracia o caralho. Que controle o povo tem sobre a apuração dos seus votos? Quero um comprovante em quem votei!
347058056038010_247391142625373	0	Se falar qualquer coisa de guei e crime omofobia agora um abobado desse ofende uma religiao inteira ai pode eu acho que independente do que vc seja o respeito e um dos atributos principais de um ser humano de bem
347058056038010_2156456221294112	0	Fake neeeeews!!!
Afe! Estão nem percebendo a lavagem cerebral.... que vergonha alheia gigantesca!!
347058056038010_278164676144347	0	Jesus  Amado e querido me perdoa até por ouvir isso , o senhor e perfeito e unico Santo  os ipocritas continuam te despresando ,nao permita JESUS CRISTO E ESSES CONTINUEM DESONRANDO SEU SANTO NOME.
347058056038010_347065706037245	1	Jesus é O Caminho, A Verdade, A Vida, A Porta, O Bom Pastor, O Pão da Vida, A Rocha, O Filho de Deus, O Salvador, O Rei, Senhor, O Santo, O Messias, O Emanuel, O Pai da Eternidade, O Príncipe da Paz, Deus Forte, Conselheiro, Maravilhoso, O Bom Samaritano, O Alfa e ômega, O Cordeiro de Deus, A Pedra mais importânte, O Filho do Altíssimo, O Noivo, O Leão da Tribo de Judá, A Estrela da Manhã, A Primícia dos que dormem, O Médico, A Raiz de Jessé, A Sabedoria de Deus, A Palavra, Filho de Davi, O Deus Filho...
347058056038010_171066597110003	0	Como vai sua DEBATEFOBIA que os médicos te deram atestado por isso kkkk
347058056038010_347061916037624	0	
347058056038010_347069079370241	0	Estes são a besta fera veio pra destruír a família ,e nunca vimos uma raiva tão grande contra Jesus Cristo.
Se Cristo e por nós ,quem será contra a nós ?
347058056038010_327366321361887	0	E o debate?
Tá muito preocupado com os amigos do Haddad.. tá com ciume? Kakakakkaka
347058056038010_327316644700188	0	Que proveito teria Bolsonaro em ir ao debate com Fernando Maldade  um sujeito desclassificado, imoral , poste de bandido  que recebe ordens de dentro da cadeia?
347058056038010_100444367599457	0	Porque ele é amigo de um cara que diz isso quer dizer que ele apoia isso? SE VOCÊ TEM UM IRMÃO BANDIDO QUER DIZER QUE VOCÊ TAMBÉM É? ME POUPE NOS POUPE!
347058056038010_248571145832826	0	Candidato, sou do Nordeste e sou seu eleitor e não abro mão. Muito, mas muito dificilmente mudarei meu voto. Acreito no que o senhor pode fazer pelo Brasil. Mas esse vídeo não pode continuar a circular. A pessoa que está com o microfone na mão não profere essas palavras. Não sou perito, mas claramente dá pra ver que ele não fala o que sai no áudio como se fosse a pessoa que está do lado de Haddad.
347058056038010_671645903221130	4	E ainda me perguntam pq voto nele? Ele é do povo, ele é humilde, ele não anda de jatinho particular pra lá e pra cá, ele é ficha limpa, ele não usou fundo eleitoral para sua campanha, ele não rouba idéias do seu opositor ele é autêntico, não muda a cor do seu partido para querer enganar as pessoas, ele tem projeto que pode sim mudar esse país eu sei que ele não é o salvador da pátria, pq o arrombo que deixaram nesse país foi tão grande que só Deus pra fazer um milagre mas acredito que ele vai fazer o impossível para melhorar nosso Brasil é por isso que sou #EleSim
347058056038010_442619559594603	0	Certeza que Jesus não se preocupava com definir sua orientação sexual, até porque isso é meramente um ato politico. Só quem tem problemas com Jesus ser gay ou não são vocês que não toleram. Intolerantes...
347058056038010_347068102703672	0	O Haddad perde por ele mesmo a unica questão é sobre a lisura eleitoral e o discurso que consolida como verdadeira as pesquisas, apuração. se isso não four colocado de forma veemente no debate público acabou vai ser aquele 51 a 49, já era.
347058056038010_292090358281654	0	Zene Brito Pra q pior do q isso. O PT se tivesse poder tal, expulsaria os cristão do Brasil!
347058056038010_347062269370922	2	
347058056038010_347066119370537	3	Capitão a luta ta muito grande.. não pensava que e a coisa era tão séria! O poder está nas mãos de pessoas podres de alma. Estão jogando sujo em tudo! Temo por sua vida.. tome cuidado Capitão eles não querem perder o poder.. envolve muito dinheiro e pessoas grandes! Que Deus continue a te proteger! E VAMOS PRACIMA POVO Brasileiro 🇧🇷😎👉
BOLSONARO 17
347058056038010_671668113218909	3	
347058056038010_278125132814968	4	
347058056038010_347067666037049	0	BOLSONARO !!! Eles não aceitarão essa derrota gigantesca quietinhos! São pessoas muito perigosas ! Tome muito cuidado por favor ! Não saia em público sem estar muito bem protegido e não tome ou coma nada dado por pessoa desconhecida ! Só um fato novo poderá nos tirar esta vitória e eles farão qualquer coisa para não deixarem o bem triunfar pois seria praticamente o fim deles ! 🙏🙏🙏
347058056038010_273149043335437	0	seja homem de verdade e vá debater com Fernando Haddad de forma limpa para todo mundo ver e ouvir, ao invés de se esconder por trás de declarações falsas nas redes socias. Qual seu projeto de governo? Incitar ódio, espalhar notícias falsas, destruir nossas instituições, atacar as minorias?
347058056038010_2213712631986555	3	
347058056038010_2156430964629971	0	Esse moço esteve em nosso estado fazendo está aberração, que o Senhor JESUS CRISTO tenha missericordia da vida dele e da nossa também!! Eu Voto 17
347058056038010_2130980213833801	0	esse cara é maluco quer nós repeitemos eles, mas eles não nos repeita!
347058056038010_442634229593136	2	
347058056038010_532042173889943	3	Perderam em 64, perderam em 2016, e vão perder agora em 2018!
347058056038010_291883298302360	0	Se vc e catolico ou evangelico que defende isso, eu sinto muito sou evangelica e tenho vergonha de ver pessoas defendendo esse tipo de coisa.
347058056038010_532046713889489	0	Diga com quem anda que eu direi quem é,  tenho muita pena de vcs , pq quem é a favor do PT ,que representar tudo isso ai contra Jesus Cristo,  vão tudo para i inferno , Jesus Cristo disse . Quem mim renegar na terra eu também renego no céu . Isso tudo é a batalha do bem contra o mal
347058056038010_282322829056353	0	https://www.nouvelobs.com/monde/20181012.OBS3874/bresil-le-succes-de-bolsonaro-dechaine-les-violences-homophobes-et-contre-le-camp-adverse.html
347058056038010_347063216037494	3	Vão todos queimar no mármore do inferno,tá na bíblia!
347058056038010_896159437250158	0	Jesus é travesti mesmooo, e é negro, e é mulher também, é lésbica, é gay, é bi e também trans, é mãe solteira e dona de casa, Jesus está dentro das pessoas, está com todas as pessoas, se acham errado é porque não conhecem Jesus e  muito menos a palavra do  pai dele. Na realidade não conhecem mesmo, afinal apoiam alguem que é a favor da tortura, logo, fariam o mesmo com alguém como Jesus.
347058056038010_532031893890971	1	Um país sem respeito a Deus é um país sem nada. Quero um presidente que seja fervoroso na fé, que incentive o respeito aos símbolos religiosos, de modo especial a cruz de Nosso Senhor Jesus Cristo, Que não vá a manifestações religiosas só para aparecer em tempo de eleições mas que viva a fé e seja exemlo de fé, E que acima de tudo, paute suas ações para agradar em primeiro lugar o coração de Deus.😇
347058056038010_1875278162561190	0	#Nao ao kitgay nas escolas, as crianças nascem, cresçam e dessidam suas opções sexuais.
347058056038010_671652269887160	0	Não sabem eles que estão precisando muito de JESUS.  SE EKES SOUBESSE ORA ONDE ELES VAO   QUE DEUS TENHA. MISERICORDIA
347058056038010_2409379182422039	0	Pior são teus amigos Malafaia e Feliciano. Esses conhecem a palavra e vivem da fé alheia, charlatões.
347058056038010_347065336037282	3	Ele quer debate, bandido acha que é assim, pra conversar com a polícia tem que se entregar, dizer onde tá o dinheiro que ele e a quadrilha roubou da salsicha, do teatro, do asfalto, dos pardais e etc
347058056038010_2130684193863403	0	Sou 17 mas sou contra ele não ir ao debate acho isso falta de respeito com o povo Brasileiro
347058056038010_442615309595028	0	Comecei uma teg #HaddadPaiDoKitGay me bloqueram os comentário do Facebook não aceita a verdade #CanalhaMilVezes
347058056038010_278136792813802	0	Ninguém defende Homossexuais  causando escândalos   O pesssoal do PT e amigos  gostam muito de ter um grupeco pra dizer que defendem. Quero um Peesidente que se comporte como presidente de verdade sem ser um demagogo correndo atras de 'causas'pra  chamar de 'suas causas ' esquecendo  das causas de todos que  é retirar o Brasil  da lama e do atraso .
347058056038010_243241063017233	0	Q merda. Eles não sabem o que falam e fazem. Q vergonha. Desculpe Senhor por tudo isso.
347058056038010_292184291605594	0	Ué? Deus não é onipotente? Então se ele for gay em algum momento pq ele pode, o senhor vai tá atacando até Deus Sr capitão!
347058056038010_278121176148697	2	
347058056038010_177822706477439	0	Só sabe divulgar fale #reidofakenewsHonesto?ele era do PP partido do Maluf há mais de 10 anos .. só saiu pra se livrar da bagagem e ganhar apoio da bancada evangélica...Investigado .. não é condenado..O que que o Bolsonaro fez em 28 anos ,além de 2 projetos,1 ainda foi vetado pelo ministério da Saúde a pílula do câncer....Compare seus candidatos,como digo não é questão de Partido,é querer o melhor pra todos,sem distinção....sem FaKE News!!!! ANTIPETISMO NÃO É JUSTIFICAVA PARA DESMERECER O TRABALHO DO FERNANDO HADDAD OU PARA VOTAR NO ÓDIO.   Compare o que os dois candidatos fizeram no decorrer de sua trajetória??? O Bolson..... com 27 anos de deputados,teve 2 projetos (um desses foi vetado depois)aprovados...vc sabe quais foram?o Haddad a lista é grande,e não foi preciso 26 anos... Compare sem ser partidário!!!! O QUE HADDAD FEZ COMO PREFEITO DE SÃO PAULO?(ele não precisou de 26 anos pra fazer o que fez,ao contrário do outro...)

1- Construiu 3 UPAs e deixou 12 em construção, antes de sua gestão, São Paulo não possuía nenhuma;
2- Recuperou mais de R$ 278 milhões desviados em esquemas corrupção para o cofre da cidade;
3- Construiu 33 hospitais Dia da Rede Hora Certa;
4- Construiu 3 hospitais gerais;
5- Construiu mais de 400 creches, a ponto de quase zerar a fila de espera;
6- Construiu universidade nos CEUs com o UniCEU;
7- Criou um órgão de auditoria independente;
8- Deu passe livre a 700 mil estudantes; (eu mesmo utilizei e agora não tenho mais acesso ao benefício)
9- Reduziu a dívida do município para MENOS DA METADE, sendo o primeiro prefeito da história da cidade a entregar uma dívida menor do que recebeu.
10- Levou a Virada Cultural para periferia;
11- Aumentou o Piso Salarial dos professores;
12- Acabou com a máfia do ISS;
13- Primeiro Plano Municipal de Cultura da cidade;
14- Reduziu as mortes no trânsito, com medidas como a redução de velocidade nas marginais;
15- Mais de 140 praças com Wi-Fi;
16- Aprovou o plano diretor, premiado internacionalmente e elogiado pela ONU;
17- Construiu mais de 400km de corredores e faixas de ônibus;
18- Entregou 400km de ciclovias;
19- Centenas de ônibus com Wi-fi, ar-condicionado, carregador de celular e de bilhete único;
20- Bilhete Único Mensal;
21- Sancionou a lei que obriga a inclusão de alimentação orgânica nas merendas das escolas municipais;
22- Instalou Fab Labs na cidade, oferecendo à população acesso a computadores com internet e impressoras 3D, além de professores para ensinar como operar os equipamentos.

O QUE FERNANDO HADDAD FEZ COMO MINISTRO DA EDUCAÇÃO?

23- Criou o Programa Universidade para Todos (ProUni), democratizando o acesso à universidade para estudantes de baixa renda e inseriu mais de 1,5 milhão de jovens no ensino superior;
24- Fortaleceu o Fundo de Financiamento Estudantil (Fies);
25- Criou o Índice de Desenvolvimento da Educação Básica (Ideb) para avaliar a qualidade do ensino nas escolas públicas no país;
26- Foi aprovada a Lei nº 11.738/2008, que fixou um piso salarial para todos os professores de escolas públicas da educação básica;
27- Expandiu e interiorizou o ensino superior;
28- Criou 18 novas universidades federais;
29- Criou 173 campus universitários;
30- Criou 360 unidades dos institutos federais;
31-Reformulou o Enem ,unificando para facilitar acesso aoEnsino Superior e posteriormente o Sisu;
32- Em 10 anos, entre 2001 e 2010, o crescimento no número de matrículas no ensino superior foi de 110%;
33- O número de alunos entre 2003 a 2014 aumentou de 505 mil para 932 mil;
34- Lancou o Plano de Desenvolvimento da Educação (PDE), por meio do PDE, houve a expansão de creches, pré-escolas e escolas técnicas;
35- Pelo PDE, houve a ampliação do número de vagas nas universidades federais e a formação de mestres e doutores, atingindo a marca 11 mil doutores formados e 30 mil mestres;
36- No que se refere ao analfabetismo, houve queda de 11% para 8,6% entre 2005 e 2011.
347058056038010_671649583220762	2	Essa gente é peversa. Quem apoia Haddad é mau caráter.
347058056038010_347059282704554	2	Haddad Nunca será meu presidente!
347058056038010_327289784702874	0	Que Deus e Jesus Tenham Misericórdia Desse Povo ..
Eles não sabem o que dizem ..🤔
Mas a Lei do Retorno é Infalível 🤔

Mas Deixem eles pra lá e seguiremos na Paz.

#B17
347058056038010_442646649591894	0	Final dos tempos. Deus, tenha misericórdia! Que blasfêmia! Q falta de respeito por Jesus Cristo!
347058056038010_327284308036755	0	Absurdo que dizer ideologia de gênero e uma afronta a eles mais chamar Jesus Cristo de gay não é , como resposta de nós cristãos vamos sim Vota 17 Bolsonaro sim 😎
347058056038010_2332918953389354	0	Isto é uma vergonha nacional que Deus tenha misericórdia e #b17 neles
347058056038010_347061742704308	2	Deus não perdoa blasfêmia, ele vai arrancar o mal pela raiz. Fora PT!!!! #Bolsonaro17
347058056038010_347066666037149	2	
347058056038010_175689156667544	0	Sangue de Jesus tem poder......Tá repreendido satanás  ...esse cara aí na platéia,  sacudiu tanto  a cabeça que acho que ele tava incorporando o 😈
347058056038010_442619349594624	0	Se exstir inferno o taxo quente já esta preparado pra eles como que um ser pode se tão abominável assim.
347058056038010_1233553490119874	2	Deus tenha misericórdia de nosso país 🙏
347058056038010_248849112471696	0	Os caras chamam Jesus Cristo de bocha travestis , quebram imagem da nossa senhora Aparecida. , Mijam em crucifixo. Daí vai o addad na igreja resar , não da. BV só faltou ele e sua vice entrar com uma imagem
347058056038010_248734325816508	0	Que absurdo! Quando vc se tornar presidente fuzila esse pelo amor de Deus
347058056038010_347072456036570	0	Esse tipo de postagem nāo ajuda em nada, e divide mais a população LGBT dos seus eleitores. A afirmação desse cara foi desnecessária, mas mais desnecessário é colocar os LGBT contra nós. Temos que aceitar que existe uma pluralidade de comportamentos sexuais no mundo. E trabalhar para melhorar a vida de todos. O que as pessoas fazem na sua esfera privada e nāo afeta a vida de ninguém, somente diz respeito a elas. Político tem que cuidar da segurança, da saúde, da economia, da assistência aos necessitados e nāo cuidar da vida pessoal de cada um.
347058056038010_335712050322677	0	1035107-70.2016.8.26.0053
Classe:	
Ação Civil de Improbidade Administrativa    
Área: Cível
Assunto:	Improbidade Administrativa
Outros assuntos:	Dano ao Erário,Violação aos Princípios Administrativos
Distribuição:	08/08/2016 às 18:55 - Livre
5ª Vara de Fazenda Pública - Foro Central - Fazenda Pública/Acidentes
Controle:	2016/001775
Juiz:	Carmen Cristina Fernandez Teijeiro e Oliveira
Valor da ação:	R$ 653.838.679,35
Partes do processo

Exibindo Somente as principais partes.   >>Exibir todas as partes.
Reqte: 	Ministério Público do Estado de São Paulo 
Promotor:  Marcelo Camargo Milani  
Promotor:  Nelson Luis Sampaio de Andrade  
Promotor:  Wilson Ricardo Coelho Tafner  
Promotor:  Otávio Ferreira Garcia 
