id	message	like_count
347058056038010_347059502704532	2039	Não respeitam nem Jesus vcs acham que eles vão respeitar o povo brasileiro.👀🇧🇷🤡
347058056038010_347063459370803	745	E não é fake tá? A prova tá aí antes que apaguem... ou digam que alguém hakkeou
347058056038010_347061262704356	342	Você ainda não percebeu q quem apoia Haddad não está nem aí para o futuro da nação?
O Brasil sofre bastante com a falta de caráter.
347058056038010_347059869371162	381	Meu presidente faça um vídeo sobre eleitores nossos não se meterem em confusão e por favor faça um agradecimento aos muitos homoxessuais e lesbicas que votaram no Senhor por favor..Faltou o gradecimento a eles
347058056038010_671644526554601	95	Hoje vai ter debate? ah esqueci bolsonaro ta de atestado por falta de conhecimento!
347058056038010_347061816037634	122	Filho de pobre se tornando médico, já existia antes do governo do PT. Agora engenheiros pilotando UBER, só depois!😢
347058056038010_175683350001458	99	Sou gay e esse tipo de atitude nao me representa.  E por atitudes desse tipo, so faz aumentar o preconceito. Ai fica difícil defender ne.
Ha tantas formas de impor respeito sem precisar utilizar de descursos sem nexo.  Lamentável!
347058056038010_347059312704551	124	Tracking BTG que acabou de sair para o mercado financeiro:
👉Bolsonaro 63%;
👇Haddad 37%.
PS: Votos válidos.

Temos que espalhar ao máximo, pois os institutos de pesquisas comprados vão começar a divulgar as falsas pesquisas onde Haddad em apenas 3 dias já se aproxima de Bolsonaro.  Querem manipular as pesquisas para fraudar os resultados.
347058056038010_347060006037815	87	Hey Capitão não caia na dele, não precisa mostrar quem ele é,  foca em vc mesmo
347058056038010_347059796037836	64	pra quem vai falar,esse vídeo não é fake,infelizmente é verdade,sou do Nordeste e o meu voto é  17,pela minha família e nação 🇧🇷
347058056038010_347061002704382	117	O desejo da esquerda não  é ajudar o país, e sim manter a liberdade da promiscuidade e mal caratismo. Vou sempre de Bolsonaro.
347058056038010_347061016037714	44	Por favor Bolsonaro ganhe essa eleição ! O povo do Brasil está desesperado 😩! O povo tá chorando confiamos em vc
347058056038010_347068182703664	61	Vou votar em vc Bolsonaro!!!
Mais espero ver mais proposta e menos críticas ao adversário! Todo mundo já sabe oque eles são! Precisamos conhecer melhor e vc!
347058056038010_347071439370005	40	Capitão, permissão para falar. Perdoe-me a indiscrição, mas não podemos cair na isca deles.Da mesma forma que não foi o senhor que quebrou a placa da Marielle e o acusaram, não podemos culpar o adversário por essa infeliz frase. O senhor não precisa disso, seguiremos à vitória apenas mostrando vossas propostas e planos para o Brasil! SELVA!
347058056038010_347062972704185	40	Você está caindo na isca do PT, esquece eles e para de criticar. É o que eles querem.
347058056038010_347067329370416	30	Meu pai os perdoem,  eles não sabem o que fazem 🙏
Misericórdia, o inimigo invadiu o mundo E o fim dos Tempos. 

#Bolsonaro17
347058056038010_347060389371110	38	E tem gente dizendo que a droga não afeta o ser humano!
347058056038010_347068982703584	26	“Não tomarás o nome do Senhor teu Deus em vão, porque o Senhor não terá por inocente o que tomar o seu nome em vão”. Êxodo capítulo 20, versículo 7
347058056038010_347061986037617	25	Bom dia, amigos! Sabemos que o nosso candidato está sendo alvo de muitas notícias falsas e pejorativas e seu nome tem sido associado a ações de violência. Pensando nisso, pensei que poderíamos promover ações sociais em nome dele. Funciona assim: No meu bairro, promovo uma arrecadação de alimentos ou visita aos hospitais ou campanha de doação de sangue. Marco um horário, todos comparecem com a camisa do Brasil e veiculamos nas redes sociais como campanha para o Bolsonaro. Assim, o nome dele estará sendo associado a atitudes positivas. Chega de campanha pela internet! Vamos arregaçar as mangas e provar que somos pessoas do bem!

Exemplos da corrente do bem!
Visitar orfanato
Visitar asilo
Visitar hospital
Doação de sangue
Nas carreatas e manifestação em favor do Bolsonaro arrecadar alimentos, roupas e brinquedos.
Plantar árvores frutíferas 
Ajudar as igrejas ou com um grupo alimentação de moradores de rua
347058056038010_347068306036985	21	Presidente , a comunidade Gay que não é representada por esse idiotia, está DESESPERADA e amedrontada que possível onda de ódio contra eles pós eleição. O senhor pode dar algum recado para eles que já sofrem tanto ?
347058056038010_671650829887304	12	Não vou falar mais de política agora que tal falar desse filme aqui Bolsonaro é tão mito que tem até um filme hahaha 😎
347058056038010_347062706037545	12	Capitão ai uma Sugestão de pergunta no debate para o Haddad sobre segurança publica: 

*“Haddad, como você vai fazer para impedir que criminosos presos continuem dando ordens de dentro dos presídios?"*
347058056038010_347060259371123	13	Capitão o senhor é tão  foda desculpa a palavra que fez o dólar recuar o mercado financeiro se enche de esperança e  ate o pt mudar de cor kkkkkkkkkkkkkkkkkkkkkkkkkkkkkkkkkkkkk 👉👉  #bolsonaropresidente
347058056038010_347069096036906	16	Opção sexual não me incomoda o que me incomoda é querer influenciar uma criança de 6 anos a ser o que ela nem sabe o que é ou ensinar a ela algo que ela só deveria aprender mais tarde, é desrespeitar a crença das pessoas e depois se fazer de vítima. Isso não vou apoiar NUNCA.
347058056038010_347059056037910	1226	Bolsonaro !! O homem que fez o PT mudar de cor, olha o poder do cara😂 #BolsonaroPresidente
347058056038010_671645346554519	11	Eleitor do pt ainda tem coragem em dizer que  "quem vota em 
Bolsonauro não é cristão"
347058056038010_327287714703081	15	E ainda tem cristãos votando nesse cara!
Votei em Bolsonaro no primeiro e agora de novo, vai ser Bolsonaro também no segundo turno.
Estamos com você, capitão!
347058056038010_347062166037599	10	Não tem respeito nenhum por Jesus esse povo ! 
Bolsonaro para endireitar esse Brasil
347058056038010_347060849371064	10	Se nós estamos nervosos , imagino o Capitão!  Se cuida pra subir a rampa, deixa o nervoso pra nós,  depois procuramos um psicólogo! !!! 😃😃😃ta.tenso 😎😎😎👉👉👉👉
347058056038010_347063699370779	16	O mesmo Jesus que eles nao respeitam, é o que livrará nossa naçao das mãos sujas do PT...

B17👊🙏🙌
347058056038010_442613532928539	12	Provérbios 13:13 -Quem zomba da Palavra pagará caro por isso, mas aquele que obedece ao mandamento será regiamente recompensado.
347058056038010_347070819370067	12	Presidente, o que é deles tá guardado. Eles podem até achar que ficarão impunes mas, a justiça divina nunca falha! #B17
347058056038010_347061932704289	9	Na minha opinião só mudaremos esse país através de 4 coisas:

* Mais educação (de qualidade) para TODOS;
* Fim das robalheiras; 
* Leis mais severas para QUALQUER UM que cometer crimes e
* Prevenção na área da saúde. 

Você tem meu apoio há décadas. Não me decepcione. 😎👉👉
347058056038010_532029420557885	12	Sou nordestina, sou mulher, sou evangélica, sou família.
#ForaPt
#BolsonaroPresidente
347058056038010_347064926037323	8	Bolsonaro vc é nossa esperança por dias melhores, os valores se perderam . Triste ver isso
347058056038010_347069289370220	8	Com Deus não se brinca.. Aquilo que o homem plantar com certeza colherá.

#PTtuahoratachegando
347058056038010_442600872929805	8	Nós cristãos seremos odiados sempre. Ainda bem que o SENHOR JESUS nos alertou com relação a isso. "Se o mundo os odeia, tenham em mente que antes odiou a mim. Se vocês pertencessem ao mundo, ele os amaria como se fossem dele. Todavia, vocês não são do mundo, mas eu os escolhi, tirando-os do mundo; por isso o mundo os odeia".
João 15.18-19.
347058056038010_347067192703763	6	Pessoal sou aqui de Fortaleza e estou fazendo campanha de apoio ao candidato, embora não tenha transferido o meu título de SP para cá. Tudo isso não vem ao caso, minha preocupação é a seguinte estou percebendo uma mudança estratégica na campanha do concorrente e não só na logomarca de campanha, mas uma mudança de posicionamento, precisamos unir as mentes conservadores intelectuais, pois esse novo mote de campanha do adversário pode levar muitos indecisos e isentões para lá. Não podemos achar que já está ganho, isso é luta diária. Eles vão tentar utilizar os programas de cabestro para atacar a sensibilidade das pessoas.
347058056038010_347070196036796	6	Chega de falar do Haddad, ele já perdeu. Vamos focar no Brasil.
347058056038010_532032327224261	2	Urgente ! coordenação da campanha PTista  além de mudar as cores do partido , agora vai alterar a vice , manuela Davila passará a vestir farda e se chamará MANUELÃO .
347058056038010_347069452703537	7	O senhor já é o nosso presidente, a esquerda tem que se acostumar!
347058056038010_347059322704550	189	Chega de política, vamos falar sobre futebol, quem você gostaria que fosse o técnico do seu time???
Haddad  👍
Bolsonaro ❤
347058056038010_278130326147782	6	Essa é realmente a página oficial do candidato à presidência do Brasil? 

Mesmo que uma simples foto entre um ator e um político significasse amizade entre os dois (o próprio Bolsonaro já tirou muitas fotos com figuras duvidosas), o que isso tem a ver com as propostas de governo de qualquer um dos dois candidatos? Isso ajuda o eleitor a decidir? É um argumento sério ou mera isca atrás de votos fáceis?
347058056038010_347061599370989	2	Sugestão de pergunta no debate para o Haddad sobre segurança publica: 
“Haddad, como você vai fazer para impedir que criminosos presos continuem dando ordens de dentro dos presídios?
347058056038010_245112329487183	3	Não quero saber disso, quero saber o que o senhor fez em 28 anos na política, vai para o debate 🙏🙏😅
347058056038010_671653723220348	5	Nossas crianças não merecem perder sua inocência na infância, sexualidade é responsabilidade dos pais ensinarem de acordo com seus princípios, crenças e na hora que acham que seus filhos estão preparados pra ouvir sobre sexo! As escolas não tem esse direito sobre nossos filhos! DIGA NÃO AO PT! ⚠️
347058056038010_175740233329103	2	AOS PETRALHAS IGNORANTES DE PLANTAO... ISSO NÃO E FAK É REAL 

Como  médico e como cristão condoído pelo sofrimento de Jair Messias Bolsonaro gostaria de esclarecer alguns pontos que foram esquecidos nestes últimos dias. Há um mês Jair sofreu um grave ferimento por arma branca que custou-lhe uma severa hemorragia interna, contaminação peritoneal com fezes devido lesão de seus intestinos delgado e grosso e consequente peritonite fecal. Foi realizada uma colostomia temporária que aguarda alguns poucos meses para ser fechada. No seu pós-operatório imediato teve uma deiscência de sutura bloqueada com oclusão intestinal. Foi novamente operado. Agora se recupera graças aos seus excelentes profissionais e ao bom Deus. Neste período tem sido vitima de impropérios e acusações tais como: o ferimento não teve gravidade, não compareceu a debates com atestado médico falso, amarelou entre outros adjetivos.  Qualquer trabalhador afastado de suas atividades pelo SUS por tais lesões gozaria de afastamento de suas funções por dois ou três meses. Bolsonaro completa agora o seu primeiro mês do trauma, ainda não completou um mês de sua última cirurgia.  Para esclarecer ao leitor leigo, seu estado geral ainda é muito precário o que pode ser visto na sua última entrevista em seu domicílio. A colostomia que é uma saída artificial de gases e fezes em uma bolsa plástica é muito inconveniente. Fezes e gases saem independente da vontade o paciente. Os gases fazem ruídos altos, audíveis no ambiente que está o paciente e as fezes, exalam um odor desagradável que pode ser sentido por quem está próximo.
O constrangimento de um colostomisado é muito grande. Imaginem num ambiente como os Estúdios da Globo e com um público de milhões de expectadores. Acredito que ninguém gostaria de se expor desta maneira. Acho injusto chama-lo de covarde, que correu do debate, que amarelou, que usou atestado frio, etc. etc. Ignorância extrema e falta de caridade cristã. Fico revoltado com tanta sujeira. Por favor respeitem um ser humano independente de suas convicções políticas.
João Batista Marchesini, CRM/Pr.1551
347058056038010_347061012704381	1	Fiquei sabendo que o Haddad pediu apoio do Messi e do CR7. Mal sabe ele que o Ronaldinho Gaúcho é melhor que os dois juntos !
347058056038010_347067432703739	3	Menos religiao e mais ideias meu caro. Nao votaremos em ti pra pastor de igreja mas pra presidente do BR.
347058056038010_347068326036983	3	Perdeu-se o respeito por tudo nessa vida mesmo! Não respeitam nem Jesus, fim dos tempos.. :(
347058056038010_532029130557914	3	Candidato e eleitores, o que ele quis dizer foi que Jesus não é excludente e está dentro de cada um, independente da orientação sexual ou gênero! Mais amor, gente! Não vamos ver maldade em tudo.
347058056038010_347063606037455	3	Candidato! Gostaria de saber sobre as suas propostas para o meio ambiente e defesa animal! Já que futuramente estarei atuando na área de medicina veterinária. Gostaria de saber um pouco sobre essas propostas. 
Desde já, 
obrigada.
347058056038010_671649776554076	1	Chega de falar de política, vamos falar sobre o Game CS GO com quem vocês gostariam de jogar uma partida:

Bolsonaro: ♥️

Haddad: 👍
347058056038010_442604416262784	5	Apelos exagerados, frases que chocam e machucam, pra que ? Não percebem que estão sendo usados para plantar ódio, desavenças, separatismo, estratégias que jogam os LGBTQ contra os héteros, contra cristãos .... projetos da esquerda para aumentar o ódio entre todo o povo, trazendo desunião porque O POVO UNIDO É UM POVO FORTE! Q tristeza vê que muitos ainda são ingênuos 😟
347058056038010_347066689370480	1	Cara, foque em suas propostas. Não tenta ficar derrubando candidato por base no que outras pessoas pensam. #VotoNULO2T
347058056038010_532028310557996	2	Haddad tirou Lula da campanha e trocou o vermelho pelas cores da bandeira brasileira.
Agora só faltar anunciar apoio a Bolsonaro.
Kkkkk
347058056038010_532038523890308	5	Nada!!!!, absolutamente nada tenho contra gays e afins.. só tenho preconceito contra mau caratismo,e contra a falta de respeito....
347058056038010_442609109595648	3	Querem acabar com a nossa fé em Nosso Deus! Jesus com um sopro irá vencer todo o mal😢
347058056038010_671653273220393	3	A vice de Haddad nega abertamente Cristo. O PT é o partido anticristo. Leiam nas propostas do PT o que eles querem fazer com a religião.
347058056038010_532028837224610	3	É duro de engolir...mas Cristo morreu tbm por essa criatura, mas tbm...17 Amados, lembrem-se do que previram os apóstolos de nosso Senhor Jesus Cristo. 18 Eles lhes disseram que nos últimos tempos haveria zombadores cujo propósito na vida é satisfazer seus desejos perversos. 19 Eles provocam divisões entre vocês e seguem seus instintos naturais, pois não têm neles o Espírito.
347058056038010_278165472810934	1	Tenho até medo de mudar minha foto do perfil na semana da criança e Haddad enviar para mim pelo correio um kit gay...
347058056038010_532062700554557	3	😱😱😱😥😥😥😥triste, o que ele pensa não me interessa ,mas deveria ter respeito pela posição de Jesus na religiosidade alheia...agora me pergunto: O que um cara deste nível, entende de Jesus???
347058056038010_442652389591320	3	Pedem respeito aos Lgbts, porém os próprios nao sabem respeitar a sociedade e a opinião politica,moral e religiosa dos outros. (Sem generalizar, tem muito gay gente fina)
347058056038010_532053460555481	1	Senhor presidente tem muitos cristão católicos apoiando-o acredito ser legal lembrar de nós também. 
Grande abraço
347058056038010_347065306037285	3	E ainda pedem respeito sendo que os mesmos não respeitam nem o maior homem que já viveu nesse mundo!
347058056038010_532030557224438	2	Calma, calma é já vamos colocar eles no lugarzinho q eles merecem,#17
347058056038010_347072969369852	2	As pessoas precisam entender que o melhor para o Brasil eh Bolsonaro...nw queremos uma venezuela no nosso pais 🇧🇷1⃣7⃣mesmo eu morando no Japao 🇯🇵meu voto e sim Bolsonaro presidente !!
347058056038010_671652533220467	2	O povo brasileiro do bem não vai se misturar com essa gente e Bolsonaro não precisa deles.😎
347058056038010_532070013887159	2	Que Deus tenha misericórdia destas pessoas. Triste demais!
347058056038010_347060382704444	2	Meu Deus!!!!
" Brasil acima de tudo Deus acima de todos"

Temos q Mostrar ha uma grande massa do norte e nordeste q o PT ao longo dos anos enganou a todos nós , fazendo nossas famílias sofrer com falta de hospitais, escolas, segurança"

Eles são capazes de tudo até jogar o povo nordestino contra todos nós, na realidade o povo nordestino está conosco nessa Batalha 🙏

"Somos todos iguais, somos um só Brasil"

🇧🇷🙏😎👉👉👉👉
#EleSim #bolsonaro2018 #bolsonaro2019
#Bolsonaro17 #Bolsonaro #BolsonaroPresidente #Bolsonaro2018EuVoto #B17 #Eleições2018 #FechadoComBolsonaro #JairBolsonaro #BolsonaroPresidente2018 #Brasil17 #BolsonaroPresidente17 #MulheresComBolsonaro #SegueOLiderBolsonaro #BolsonaroEleitoPrimeiroTurno #EstouComBolsonaro #FlavioBolsonaroSenador177 #BolsonaroRJ #BolsonaroBrasil #VotoFamíliaBolsonaro #SomosTodosBolsonaro #VotoBolsonaro17

#MelhorJairSeAcostumando
347058056038010_532030853891075	2	Que absurdo!!!! Que falta de respeito. Todos os limites da ignorância foram ultrapassados. Opção sexual é diferente de falta total de respeito. O menos é sempre mais e eles não percebem. Capitão, a luta continha, vamos lá!!!!!
347058056038010_347070499370099	0	João Pedro Barbosa se ele por isso no horario eleitoral dele ele leva com 100% dos votos totais
347058056038010_671658196553234	2	É justamente isso que não queremos para o nosso Brasil e você teve a bravura de erquer a bandeira contra isso e muito mais na tentativa de resgatar o respeito e a dignidade do povo brasileiro. Você Jair Bolsonaro é digno de elogio. Meu voto é SIM e denovo eu digo pela MORAL e os BONS CONSTUMES, voto sim, Bolsonaro sim. Presidente do Brasil....Glória Deuxxx. Vai dar tudo certo no nome de JESUS, AMÉM !
347058056038010_278140449480103	2	"A melhor propaganda anticomunista é deixar um comunista falar"
Paulo Francis -  jornalista, crítico de teatro, diretor e escritor brasileiro.
347058056038010_532034800557347	1	Quando o general Mourão falou merda,o senhor falou que ele não estava autorizado a falar sobre o governo,agora te pergunto o que o Haddad tem a ver com a fala ? E olha que o senhor tá na frente das pesquisas imagina o desespero se estivesse atrás.
347058056038010_910165715848971	0	Mano que caralho de argumento é esse? 😂😂 meu tanta coisa pra criticar e me vem um negocio tão sem sentido? Pessoas, melhorem!
347058056038010_347072586036557	1	Temos q ir no debate sr. Presidente, vc vai mudar voto de muita gente se for, e se não for pode mudar voto de muita gente só q pro lado de la, valorise cada voto de cada um q vc receberá.
347058056038010_532034553890705	2	#CapitãoJairBolsonara 
não vá  por esse lado ,não precisamos mostrar quem ele é,  foca em vc mesmo !Continue mostrando o que vc vai fazer pelo país! Vc chegou até aqui com 46,7% sem precisar disso!!Estamos todos juntos por um Brasil melhor !O que ele quer mesmo, que falem dele bem ou mal ,para aparecer todas as horas na rede social! Qdo tiver mentira sobre vc ,mostre a verdade é assim que vamos ganhar !!#Bolsonaro17
347058056038010_154780152135992	2	#FraudeNÃO!
VAMOS ÀS RUAS TODOS OS DIAS!
EXIGIMOS #VOTONOPAPELJÁ! 😡
#ApuraçãoTotalmentePÚBLICA!
347058056038010_347062746037541	1	Horror ! Que vergonha de gente assim 😔 não sabe o q esta falando e o povo aplaudindo ainda !
347058056038010_347069712703511	2	O pior cego é aquele que não quer ver, ouvir, nem acreditar. O pior cego, é aquele se faz de surdo. #MudaBrasil 🇧🇷
347058056038010_372366313502975	1	UMA MOÇA TEVE UMA BELA SACADA sobre a questão do voto impresso. Mas, não consegui localizar o vídeo dela. Agora no segundo turno, quando votarmos em JAIR BOLSONARO, cada um de nós, receberá um comprovante de votação. Guarde-o bem, não o jogue fora. Se houver fraude podemos nos reunir, eleitores de BOLSONARO, cidade por cidade, para contarmos os votos depositados em nome de JAIR BOLSONARO. Com essa atitude, podemos inclusive, ajuizar ação coletiva, também cidade por cidade, para exigir que o resultado das urnas bata com a quantidade de comprovantes que todos nós recebemos. É uma forma real, concreta, de afirmarmos que votamos em nosso candidato. Ninguém poderá nos desmentir. Não acredito que haverá fraude no segundo turno capaz de modificar o resultado em desfavor de JAIR BOLSONARO, porque, será uma lavada. Mas, considerando que o seguro morreu de velho, vale a pena guardarmos o nosso recibo de votação... Propague essa ideia para que todos os eleitores de JAIR BOLSONARO guardem seus comprovantes. Felicidade a todos, sucesso, até a vitória.
347058056038010_347071206036695	2	Cara eu nunca fiz tanta campanha na minha vida...e de graça, pk tenho ideais...pk sei q vc é o melhor para o Brasil hoje...continue sendo pulso firme e honesto...precisamos de homens e mulheres assim no Governo do Brasil ...#Bolsonaro17
347058056038010_532042570556570	2	Se esse Haddad e um sem futuro acha que fazendo polícia assim vai ter o voto das famílias não respeita nem Jesus  não respeita as família nem nossos filhos 17 sim Deus acima de todos
347058056038010_175719463331180	2	Gente mimada e confusa. Qual a explicação LÓGICA pra essa fala? ou é apenas bastante LSD na cabeça???
347058056038010_532054290555398	2	Era uma vez , dois brasileiros:
No passado , um defendia o Brasil e o outro era preso..
Tempos depois , nada mudou!
347058056038010_442616362928256	2	Isso é uma pouca vergonha para nós adultos. Imagine nossa crianças vendo isso que vai pensar de Jesus...nós fala uma coisa do nosso DEUS nosso Senhor Jesus Cristo .esse povo fala outro ...🙏🙏..BRASIL ACIMA DE TUDO E DEUS ACIMA DE TODOS. 17 ✅PARA UM PAÍS MELHOR..BOLSONARO
347058056038010_532048033889357	2	Não precisa nem tirar conclusões e 17 mil vezes Bolsonaro sem duvida
347058056038010_671668366552217	2	Vcs tem que entenderem que essas pessoas que difamam a igreja, as religiões são pessoas insignificantes, despreparadas, disprestigiada e minorias, são pessoas que achavam que o povo brasileiro eram complacente com essas posturas, são  pessoas do mais baixo nível acadêmico, pessoas que querem aparecer e se tornarem famosas por estarem ao lado de pessoas públicas, e esses que acham que vão conquistar a opinião da sociedade, apoio e algo  mais, só estão conseguindo desprezo, e dispentando no povo o lado primitivo que por sua vez pode desencadear furias fora do controle, lembrem -se que a política passa, mais a vida continua e aí é que teremos a necessidade de arcarmos com nossos atos e posturas, e lembrarmos o que fizemos no passado para colher no futuro.  Pensem nisso.
347058056038010_442602132929679	1	Eles não tem respeito pela nossa religião, não tem respeito pelo nosso povo!
347058056038010_2156171381322596	1	Amigo pq tirou uma foto? Sério, deputado? https://extra.globo.com/noticias/rio/bolsonaro-ameaca-quem-divulgar-fotos-suas-com-coronel-imagem-se-torna-viral-20115040.html
347058056038010_442621052927787	1	Esse governo é o que mais perseguiu cristãos. Existem vários projetos do sr. Willies e Erundina,  que estão na iminência de serem aprovados com relação a fé cristã. Esperando que vocês continuem com a luta em nossa defesa contra esses absurdos.
347058056038010_290379445024048	1	Nunca foi permitido votar com camisa do candidato ! Justo agora que as pesquisas finalmente assumiram a liderança do Bolsonaro, o STF libera às vésperas da eleição o uso da mesma ! Será que só eu estou percebendo o golpe aí gente!? Pelo amor de Deus, é só o mesário colocar o número ao lado da assinatura e anula nosso voto ! Não se esqueçam que Os ministros do STF foram em sua quase totalidade indicados por Lula e Dilma! Já deram varias provas que são contra o povo! Não acho nada prudente comparecer na seção com camisa do candidato, e digo mais, agora que eu não vou mesmo de amarelo! Não vamos deixar tudo se perder na reta final ! Querem usar amarelo ou a camisa do Bolsonaro usem após votar e bem longe das zonas eleitorais! 
Texto Copiado
347058056038010_532037120557115	1	Bicha é o pai dele que mão deu educação suficiente em casa , eu apanhei e aprendi respeitar as pessoas e suas religioes ...
347058056038010_487248481753400	1	Meu Deeeeus!! O q me resta é orar por esses seres,pedir clemência p q Deus perdoe a alma deles🙏🙏🙏🙏
347058056038010_442639332925959	1	Isso que eles querem disseminar o contra a bíblia.
Estamos juntos dia 28!
347058056038010_671645189887868	1	Daí satanás
Pra trás mim
Sangue de Jesus Cristo tem poder
Senhor coloco em tuas mãos essa gente que plasfemam contra a tua palavra...... misericórdia Jesus
347058056038010_442615349595024	1	Bolsonaro precisa mudar a #COR das camisetas. Pois nao me custa comprar outra.
😂😂😂😂
347058056038010_2214877585203393	0	Não respeitam a familia zombam da fé do brasileiro,artista que suas opniões vale menos que um centavo
