id	message	like_count
2173079989479335_2173506326103368	0	Da mesma forma que está de olho no nosso Petróleo. Estratégia eficaz. Favorecer uma forte crise no País, derrubar o lider político repassando informações estratégicas e colocando a opinião publica contra ele e se não der certo...guerra....Devem estar rindo do Brasil, foi muito mais facil que na Venezuela. O Petroleo é deles.
2173079989479335_2173470992773568	0	Tá na cara né? Aí fica aí na mídia dizendo que tá preocupado com o povo que tá passando fome fala sério Trump
2173079989479335_2173364679450866	0	Cirão, já leu o livro confissões de um assassino econômico? #Recomendo

Gostaria de ler um livro seu, mas não encontro!
2173079989479335_2173581276095873	0	Kkkk o famoso " ouvi do tio de um cara que conhecia um cara que ouviu trump dizer isso". Para com isso neh
2173079989479335_2173108596143141	0	Vc quis dizer que a venezuela não aceita subrono Ciro?
2173079989479335_2173464696107531	0	Grande novidade!!! São os salvadores da pátria rica em petróleo....
2173079989479335_2173161372804530	0	Nem Maduro nem Guaidó. Não seria possível se pensar uma transição pacífica com uma espécie de junta tripartite?
2173079989479335_2173097946144206	0	Triste os comentários! Aff!
2173079989479335_2173108022809865	0	Bush precisou ir a guerra contra o Iraque pra se reeleger.
2173079989479335_2173109162809751	0	Dunga Falcão vc ingênuo
2173079989479335_2173445592776108	0	Descobriu a pólvora!!
2173079989479335_2175479239239410	2	Flavia Guimarães Felipe Vicente Paulopress Paulo de Tarso Mauro Freire Abimorad
2173079989479335_2173612169426117	0	Paulo Henrique Ito, Ah vá kkkkk.
2173079989479335_2175028932617774	0	Comunista Opressor
2173079989479335_2173085166145484	0	1mmmmmm Everton Cardoso
2173079989479335_2173128899474444	0	Thiago Castro treta
2173079989479335_2173347342785933	0	Derlis
2173079989479335_2173261186127882	0	Eunice Teodoro
2173079989479335_2174739172646750	1	João Felipe Ferraz
2173079989479335_2173251512795516	1	Really?!???
2173079989479335_2173308326123168	0	Só falta chamar o chefe do FBI de ser bolivariano, rs
2173079989479335_2175478782572789	0	Andre Oliveira
2173079989479335_2173090829478251	0	Ora ora ora, temos um Xeroque Holmes aqui
2173079989479335_2173798099407524	1	Vivian Oliveira
2173079989479335_2173282472792420	0	Rafael Brasil
2173079989479335_2173106139476720	0	Nice Lima
2173079989479335_2173150596138941	0	Xerox Holmes
2173079989479335_2173481046105896	0	Ziza Pires
2173079989479335_2175057829281551	0	Pedro Estevam Freiesleben Rosso
2173079989479335_2173211386132862	0	Descobriu a pólvora
2173079989479335_2173158552804812	0	Erileuda
2173079989479335_2173273382793329	0	Não diga? E eu que pensei que era para roubar o Quesillo 😋
2173079989479335_2173407992779868	0	No Brasil  foi só na idéia  mole mole
2173079989479335_2173533592767308	0	A má intenção de Trump justificaria darmos as costas a sofrido povo venezuelano?

Ciro deu quando apoiou o regime.
2173079989479335_2173389316115069	0	Ora ora temos um xeroque romi por aqui
2173079989479335_2174087786045222	0	Realmente é uma lástima que a população não esteja entendendo isso .
2173079989479335_2173112169476117	0	Enquanto os políticos fazem discurso o povo morre de fome
2173079989479335_2173629752757692	0	E a Rússia/China quer o quê?
2173079989479335_2173271999460134	0	Tudo verdade... EUA quer o petróleo da Venezuela.. não estão preocupados com o povo que morre de fome.. lamentável
2173079989479335_2174519476002053	0	Agora que perceberam????
2173079989479335_2173565209430813	0	Kkkkkkkkkkkkkkkkkkkkkkkkkk doentes
2173079989479335_2173181306135870	0	Aqui no Brasil o Trump vai pegar o petróleo de graça sem gastar uma bala.
2173079989479335_2173168922803775	0	Ora, pra, parece que temos um Xeroque Romis no Globo...
2173079989479335_2173579866096014	0	Ora ora... temos um Xeroque Rolmes aqui....
2173079989479335_2173306086123392	0	O maduro devia comprar da Rússia um míssil nuclear e por em direção EUA,  e dizer o acaba o embargo ou acaba América. Simples assim.
2173079989479335_2173505729436761	0	Veja a matéria, o A disse ao B que ouviu o que C disse sobre a Venezuela. Esta democracia fake defendida pela esquerda corrupta e doentia de nosso país.
2173079989479335_2173152556138745	0	Estimado Ciro, acho pouco provável que tenha tempo para responder a duas perguntas, mas tentarei mesmo assim: 

Se isso de fato acontecesse, quais seriam as consequências (mais prováveis) disso para o Brasil?

A CIA há muito tempo está infiltrada na nossa inteligencia. E o que podemos fazer pra desmascarar/desmantelar isso?
2173079989479335_2173378832782784	1	Mais óbvio que isso somente a imbecilidade do desgoverno bolsocoisa
2173079989479335_2173294659457868	1	Só a Zumbilândia acha que essa briga toda é pq causa de Democracia . E o Brasil fazendo o jogo  dos parasitas .
2173079989479335_2173445722776095	0	Quem não sabe disso! Ninguém ali está preocupado com o povo venezuelano que vem sofrendo horrores.
2173079989479335_2173464089440925	0	Quem não sabe disso .
O abana rabo dos EUA ,o Capitão segue o biltre.
2173079989479335_2173484846105516	0	E a Rússia não quer nada pq Putin é bonzinho e inclusive tá na Síria não por causa do gasoduto é pq o Putin é muito generoso é sim o trump é malvado demais inclusive passa por cima do próprio povo com tanque ops foi o maduro que o Ciro disse que e um democrata kkk
2173079989479335_2173877942732873	0	E a Rússia e China dom apoio  maduro apenas para contrariar Trump hahahahahaha
2173079989479335_2173100856143915	0	Com certeza os americanos querem o petróleo nem tão com povo, ele só quer um presidente sabujo na América do Sul que abrace essa encrenca
2173079989479335_2173088716145129	0	Ciro o que tá faltando pra esses parlamentares pedirem o impeachment desse governo de incompetente.
O governo do retrocesso!
2173079989479335_2173218416132159	0	Se alguém tem duvidas disso e troxa os americanos não valem nada
2173079989479335_2173122422808425	1	Todos sabem isso!
Se ele estivesse querendo dar ajuda humanitária não faltaria país pobre pra ele enviar remédios, roupas e comida!
Haiti,Angola e outros que foram vítimas de tempestades e furacões!
A questão é que VENEZUELA é rica em minérios e petróleo!
E ele está de olho nessa fortuna! 
O que está empobrecendo cada vez mais
os venezuelanos são os imbargos políticos que proibem  os outros países de negociar com a Venezuela!
Biscoitos,bolachas,leite,carne etc!
2173079989479335_2173104539476880	0	É óbvio mas isto não é desculpa para deixar Maduro destroçar o que sobrou da população...
2173079989479335_2173553249432009	0	Mas os bolsominions achando que o Trump quer a liberdade e democracia para a Venezuela.
2173079989479335_2173189689468365	0	Se mexer c a Venezuela vai deixar Putin putim e isso eles não querem. 😂
2173079989479335_2173087399478594	0	Que estranho a Rússia apoiar Maduro né? Será que por causa da dívida de U$17bi ou pra continuar a comprar os ativos pretoliferos a preço de banana?
2173079989479335_2173100529477281	0	Como se já não soubéssemos as causas do povo passar necessidade naquele PAÍS. 
EUA, país construído sob a MAÇONARIA. 
Não presta, povo tupetudo,  arrogante.
2173079989479335_2174396609347673	0	E o babacão do Bolsoasno querendo entrar em guerra,  por causa de algo que o Brasil nada tem a ver nem a ganhar.
2173079989479335_2173092306144770	0	Já ganhou o nosso, agora a cartada final a Venezuela. Juntos temos mais petróleo que os árabes então pra liderar o mundo falta pouco.
2173079989479335_2177989768988357	0	Vai pra Venezuela Ciro já que vc gosta tanto do Maduro!! Ou melhor vai na divisa prestar ajuda aos refugiados faça algo útil!
2173079989479335_2174345832686084	0	Aqui no Brasil teve os trairas que entregaram nosso petróleo. Mereciam enforcamento ou prisão perpétua por alta traição ao povo brasileiro?
2173079989479335_2173270459460288	0	O Trump fanfarão, os americanos se metem demais na terra dos outros, já estou com saudades o Obama
2173079989479335_2173087742811893	0	E os venezuelanos queremos dar de graça se tiram ao Maduro, o acordo perfeito!!!
2173079989479335_2173085856145415	0	Óbvio que sim, é óbvio também que a Rússia, país aliado só quer isso também, o resto é conversa pra boi dormir!
2173079989479335_2173095396144461	0	Bota o Ciro nos stories diariamente, ficar mandando equipe soltar nota na pagina e feio
Deixa o caba falar
2173079989479335_2173356852784982	1	E a a Russia ta defendendo a Venezuela por qual motivo?
2173079989479335_2173172632803404	1	xerok rolmes
2173079989479335_2173097452810922	0	A fonte é tipo um Ciro Gomes americano.
2173079989479335_2173495782771089	0	Anderson seu Ciro é doente
2173079989479335_2173436876110313	0	E O BRASIL COM AS BARBAS DE MÔLHO...
.
 EX-DIRETOR DO FBI AFIRMA QUE TRUMP QUER GUERRA NA VENEZUELA (*PARA ROUBAR) POR CAUSA DO PETRÓLEO.
.
2173079989479335_2173592976094703	1	Mentira, eles só querem salvar os Venezuelanos.
2173079989479335_2173768106077190	0	Só  retardados não sabem disso.
2173079989479335_2173100449477289	0	Ora ora, temos um xeroqui rolmes aqui
2173079989479335_2173107022809965	0	Achei que é porque ele queria ajudar os venezuelanos
2173079989479335_2173177732802894	0	ora ora temos um xerolque homes aqui kkk
2173079989479335_2173167789470555	0	Esse cara é doente
2173079989479335_2173485679438766	0	Só os acéfalos lambe botas não viu isso.
2173079989479335_2174302879357046	0	E surpreendeu somente os Bolsominions......... Rsrsrsrs
2173079989479335_2173163592804308	0	Ora ora ora temos um xerolque Gomes
2173079989479335_2173194292801238	0	Le vem o cara que disse a Venezuela  e uma democracia  igual a da EUA
2173079989479335_2173159626138038	0	Trump ta cagando pra os venezuelanos...
2173079989479335_2173199376134063	0	Vala, eu nem sabia!
2173079989479335_2178748458912488	0	Mas o Putin pode, né? Kkkkkkkkkkk
2173079989479335_2178748442245823	0	Mas o Putin pode, né? Kkkkkkkkkkk
